,id,date,dateYear,dateMonth,dateDay,rating,userName,content
174,175,20220106,2022,01,06,1,도레미파,"사용자를 왜 약올리는지 모르겠네요 자꾸 뭘 하든지 맨 처음 화면으로 시작하기 / 기존방식으로 로그인 이 창이 계속 나오는데.. 계좌비밀번호를 몰라서 재등록을 하려고 휴대폰 본인인증을 하면 휴대전화 번호가 등록되어있지 않다고 하면서 개인정보 변경 페이지에서 휴대전화 번호를 등록해 달라고 합니다 등록 하려면 은행창구를 이용해야하는건가요? 그런거라도 말해줘야죠.. 그리고서 맨 처음 그 로그인 화면인 시작하기 / 기존방식으로 로그인 화면으로 다시 돌아가기만 해요 어떻게 해야하는지 설명이라도 해주든가.. 이런식으로 불친절하게만 나오면 어쩌라는건지 참.. 국민은행, 우리은행 어플도 그렇게 잘 만들었다고는 생각 안 했지만 하나은행은 진짜로 말을 할 수가 없게 하네요 주택청약 예전에 넣어둔게 있어서 버리지만 못하고 이게 뭐 하는건지.. 통합검색 기능 이용해서 개인정보 조회/변경 하려고 해도 맨 처음 그 창으로만 갑니다 로그인 창 자체를 시작부터 나오게 하는걸 없애든지 하세요.."
175,176,20200918,2020,09,18,1,쏘쏘,적금해지하려함 > 구하나어플로 하려니까 모바일OTP 필요 > 발급버튼 누르면 무한로딩 > 삭제 후 신하나어플 다운 > 모바일OTP 받고 적금 해지하려니까 신어플에선 필요없는지 자동인식된건지 그냥 넘어가짐 > 적금 해지 후 이체 시도 > 타행 공인인증서 미등록됐다고 이체 안된다는걸 마지막 단계에서 알려줌 > 어플 간편인증 후 재시도 > 이체한도 걸려서 안된다는걸 마지막에 알려줌 > 이체한도 금액 얼만지 안알려주길래 어플내에서 검색해보니까 키워드검색이 제대로 안돼서 대충 한도 때려맞춤 > 내일 또 잔금 옮겨야함 요약 : 적금 하나 해지하고 돈 1회 이체하기까지 1시간 걸림 (신분증 재촬영도 20번 넘게 함) 은행어플 쓰면서 짜증난 적은 있어도 열받은건 처음입니다. 잔금 다 옮기면 어플 삭제하고 이제 적금도 여기서 안들려고요.
176,177,20211222,2021,12,22,3,겸재냥,솔직히 업데이트 진짜 구렸거든요. 업데이트 전까지만 해도 수월했는디 무슨 하나페이? 이런 거 메인페이지에 들어고나서는 잔액확인도 힘들고 무슨 삼성페이처럼 만들어두고 암만 카드등록을 눌러서 인증 다 하고 해도 잔액은 0원이고 부채 삼만원으로 뜨는거예요. (버스비 후불결제값) 송금은 메뉴>카드 뭔 관리>따로 로그인하고 등록후 상세정보 누르고 이체하기 눌러야 보낼 수 있었나? 이것도 일주일 내내 뒤져서 진짜 별거 다해보고 간신히 찾았어요 암튼 그래서 근래 한달동안 하나은행 못 썼어요... 저만 그런가요?ㅠ 바로 어제까지 거지같앴는데 오늘 업데이트 된건지 나아졌네요... 쓸데 없는 기능 싹 밀고 메인 화면에 내 계좌 잔액이랑 보내기 이런 거 있으니 이것만 해도 감사하네요... 진짜로... 지난주엔 카드 등록은 했는데 인식이 안되니 이주일동안 돈을 못 빼가지고 답답하고 짜증나서 카드사 바꿀뻔...ㅋㅋ진짜로!!!! 마케팅은 뭔가 열심히 하시던데 페이지 관리 잘좀 부탁드립니다!!!!ㅠㅠ
177,178,20201117,2020,11,17,1,이ccc,앱이 실행이 몇일째 되지않고있어요 계속 로딩화면만뜨고 지웠다가 다시깔아두 그러고..원래됐었는데...저만이런건가요 안드로이드 버전도 10으로 최신인데요 ->해당문제는 답글주신대로 하니까 해결됐는데요 하나원큐전세대출 한도조회가 오류가발생했다면서 계속 안돼고있어요..
178,179,20200927,2020,09,27,1,songi Han,"이체할 때 문제 많음 1. 자세한 정보를 입력하는 칸이 접혀서 안보여서 꼭 내용을 입력해야 함에도 불구 예금주 이름으로 얼결이 이체해버리는 불상사 발생. 2. 비밀번호를 여러건 체할 때마다 반드시 입력해야하는 번거로움 3. 이체할 때 은행부터 선택해야 하는데 무조건 '이름이나 번호를 입력해보라'고 함. 이게 선진적인 것일 수도 있으나... 불편함, 정서에 맞지 않음. 4. 화면이 대체로 산만함. 어플 안 쓰고 다시PC로 돌아가게 만드는 디자인."
179,180,20201027,2020,10,27,1,전상현,왠만해선 리뷰안남기는데.....이건 너무하자나요....기존에 빠르고 최적화 잘되있는 앱을 사용중인데 업데이트도 아니고 서비스종료된다고 새로 깔았더니 이건 뭐 버튼하나 누를때마다 한참씩걸리고 뭐좀볼라고하면 기능이 숨겨져있나 더 어려워졌고.....아니 왜 잘쓰던걸 냅두고 이런 어플을 만들어서 쓰라고하나요? 앱개발자가 대단한사람이라 어쩔수없이 쓰는건가 ㅠ 암튼 최적화좀 해주세요 너무 느려요 폰이 후진것도아닌데 하나은행 어플만들어가면 인내심이 폭발해요 ㅠ ㅋ
180,181,20201012,2020,10,12,1,난삵희얌,"앱 깔고 들어가서 시작하기 누르면 휴대전화 인증 뜨길래 다 적고 인증번호 요청 했는데 아무리 껐다켜도 계속 휴대폰 본인확인에 실패했습니다. 입력된 본인정보를 확인해주세요. 이러네요. 그래서 다른 방식으로 인증하기도 해봤는데, 계속 자꾸 오류가떠요. 본인확인도 못하게 하시면 어떡하라는거죠."
181,182,20200909,2020,09,09,1,영건,"만드신분은 고생했겠지만 고객의 입장에서 보면 정말 쓰레기 같은 앱입니다. 기존 버전이 사용이 더 간편하고 직관적이며 정보도 많아 실수가 적었으나 지금은 심플이라는 미명아래 누구에게 보내는지도 모를 정도로 정보가 빈약하며 복사 붙여넣기도 2회이상 사용하지 못하고 심지어 폰트도 작아 잘보이지도 않아서 40대 이상도 사용이 어렵습니다. 이런거 만드느라 고생마시고, 그냥 신한은행이나 구버전 따라해주세요 그리고 책임자는 경쟁사 간첩입니까? 이따위 앱을 매인앱으로 선정하다니... 책임을 지시고 자리에서 내려오시고요 왜!!! 구형이 더 평가가 좋은지 밴치마킹좀 하셨으면 합니다."
182,183,20201015,2020,10,15,1,Arthur Young,"초기에 깔고 너무 형편없어서 구버전 사용할테니 계속 유지하도록 리뷰 남겼습니다. 다건이체부터 계좌보기 뭐하나 제대로 수정한건 없고, 제가 지적한 문제를 다른 분들도 다 지적하는데 바꿀생각은 안하고, 그러면서 11월중 종료한다고 하면 어쩌자는 건가요? 다들 구버전이 낫다고 하는데, 그럼 구버전에서 불편한 게 있으면 업데이트 하면되지 왜 굳이 다들 불편하다는데 왜 바꾸라고 하지요? 정말 앱때문에 은행을 옮기겠다는 말들이 무수히 나온데도 그대로 두는 이유가 무언가요? 구버전같이 직관적으로 바꿀게 아니라면 구버전을 반드시 유지해주십시요. 아니면 정말 바꿔야할듯 합니다."
183,184,20201014,2020,10,14,3,한용희,"기존에 사용하던 빠른 이체가 없어졌어요ㅠ 그리고 여러개의 계좌를 사용중인데 주거래 계좌가 로그인시 처음화면에 볼수 있게 계좌 순서 바꿀수 있으면 좋겠습니다. 그리고 지문인증이 없고 얼굴인증이 생겼는데, 직엄 특성상 카메라 보안스티커를 붙이고 일합니다. 근무중에는 얼굴인증을 할수가 없어요 ㅠ 지문인증도 만들어주세요."
184,185,20200907,2020,09,07,1,Minjeong Kim,이전 앱의 경우 입출금 컬러가 달라 소비한 내용을 한 눈에 알기 쉬웠는데 지나치게 심플해져서 오히려 이용이 불편해졌네요. 패턴 로그인도 지원이 안되구요. 디자인도 이전 버전이 훨씬 나은거 같은데 굳이 새 앱으로 업데이트 한 이유를 모르겠어요.
185,186,20211222,2021,12,22,1,깡알남편,업데이트전에는 앱실행하면 간편비빌번호 등록이 떳는데 업뎃후에는 필요도 없는 홈페이지 개선광고뜨고 (개선된걸 굳이 저렇게 고객들 불편하게 만들면서 광고해야되나 싶고) 어차피 로그인해야 기능 쓰게 해줄거면서 은행화면은 왜 보여보여주는지 그리고 계좌이체할때 추가이체 하는거 따로 안내안해서 비번4자리 누면 그냥 하나만 이체되어버림 다른 어플들은 추가이체 하시겠습니까 같은화면에 뜨는데 하나은행만 굳이 비번누르는 화면을 지워야 추가이체 화면이 뜨게 하는지 모르겠음
186,187,20200601,2020,06,01,1,몽구스,하나원큐라고 광고하지마요 허위광고네 뭔 알림받는데 앱을 또 깔고 뭐하니까 또 깔고 심지어 기존 push서비스 이용자는 그대로 쓰게 냅둔 상태에서 기기변경때문에 재등록 눌렀더니 무조건 앱 다운로드하라그러고 이게 무슨 한방에 해결입니까. 거지같네요 주거래은행 바꿀까도 고민중입니다. 선택지 없는 선택창 만들고 무조건 설치하는거 좀 작작해요 액티브엑스입니까? 안깔면 세상이 무너집니까? 있던 서비스 유지하면서 신규/재등록 고객만 굳이 필요없는 기능까지 억지로 쓰라고 설치합니까? 간편의 뜻을 모릅니까 필요한 기능만 넣으세요 어플 여러개로 늘릴거면 이름은 왜 원큐입니까 투싸우전드큐 하시죠. 알람 받는게 이리 거지같아서야 오래 쓰겠습니까. 사용자 기만하지 마세요.
187,188,20211106,2021,11,06,1,KT5TYLE,"참.. 뻘짓 잘한다. 잘되던걸 뭘 어떻게 바꾼건지.. 금토 사이 앱자동업뎃 이후 원큐페이 실행하면 하나카드가 아니고 하나멤버스가 자동으로 나오고, 홈화면 바로가기로 실행하면 튕기고 이게 뭐하는 짓이지? 그리고 업뎃을 꼭 금토 사이에 하는 이유가 뭐냐.. 버그있어도 쌩까겠다는 건가? 이런 오류는 별거 아니라고 생각하는건가. 진짜 가끔가다가 통장부터 카드까지 싹 다 갈아엎고 싶게 만드는 하나은행 하나카드.. 제발 자중합시다"
188,189,20211215,2021,12,15,1,아저씨,하나은행 앱을 많이 사용하는 유저로서 이번 개편은 정말 아닌 것 같습니다. 이전에도 덕지 덕지 하나 계열사 배너들이 정리되지 않은 채 나열되서 스크롤 내리는게 짜증 나긴 했는데...이번엔 또 새로운 .... 결제 쪽은 스와이프 방식을 위주로 띄어놓으니 해외 결제 가려면 스와이프로 2번 밀어야 하는 것 처럼 보이네요..차라리 버튼식만 하면 헷갈리진 않을 텐데... 그리고 메뉴들이 글자 비율이나 이미지 비율이 작아서 화면이 너무 없어 보입니다. 화면 활용 능력이나 배율에 대한 센스가 좀....디자인이 너무 대학생이 만든 조과제 같아요.....세련되 보이지 않습니다. 고민을 좀 더 하셔서 만드시길 바랍니다. * 하나 마이데이터는...제 정보가 아닌 타인 금융 정보가 나와서...많이 놀랐습니다.
189,190,20190905,2019,09,05,1,Google 사용자,푸시알림이 오지 않습니다. 설정에서 알림도 on으로 되어 있고 앱에서 계좌도 정상적으로 등록되어 있습니다. 모바일데이터 백그라운드 데이터 사용도 on으로 되어있는데 푸시알림은 계속 오지 않네요. 어떤 문제인가요?
190,191,20220228,2022,02,28,2,sh jang,"앱 시작하면, '가져오기'라는 용어가 크게 보이는데, 간혹 난감합니다. 무엇을 가져오나요? 본인이 이체후에도 계속 '가져오기' 가 나타나는데, 이체금액을 다시 회수,가져온다는 용어인지? '입출금내역보기'가 오히려 맞는 용어로 보입니다. 용어정의를 개발자 편견으로 사용하시면 난감합니다."
191,192,20200827,2020,08,27,1,ssun J,하나원큐 처음 설치 때부터 오늘 업데이트 때까지 제 폰에서 하나원큐 앱이 없습니다 앱스토어에서 하나원큐를 검색해서 열기를 누르고 들어갑니다 제 폰에서 '하나'라고 검색하면 하나멤버스 앱 한개만 뜹니다 왜이러는걸까요 이미지도 캡쳐해놓았어요 어디다가 보내드려야될까요? 참 불편하네요
192,193,20200916,2020,09,16,1,박은지,아니.... 급한이체건 있는데 어플실행 왜갑자기 안되냐고요!!!! 지난버전의 어플때도 사용번거롭더니 이번에바껴도 이러면ㅡㅡ모니터링하고있는건 맞아요? 당신들도 이은행어플쓸거아니에요? 안불편하냐고요 메뉴얼불편한건 떠나서 사용은되게 해야죠!!!왜 툭하면 어플실행이안되거나 로딩이 지속되는 오류가 발생하냐구요!!!!
193,194,20210305,2021,03,05,1,김용범,신분증 인증이 전혀 안되네요. 어두운 배경에서 빛반사 없이 찍어도 일치하는 정보가 아니라면서 인증에 실패합니다. 최신 신분증에는 옛날에 가지고 놀던 딱지처럼 보는 각도에 따라 숨겨진 그림이 여러개 보이는데 혹시 이것때문이 아닐까 조심스럽게 생각해봄니다. 신분증 인증부분에 대한 개선을 부탁드립니다.
194,195,20201013,2020,10,13,1,현영진,기존방식 잘 쓰고있다가 신규앱 깔았는데 아무래도 보안이 너무 취약한거 같아 불안합니다 간편 로그인 번호누르고 로그인하고 계좌이체도 통장비번 4자리만 알면 인증절차없이 바로 송금되네요 이럴꺼면 otp는 왜 만들고 공증인증서는 뭐하러 발급하나요 핸드폰 잃어버리면 불안해서 쓸수가없겠는데요
195,196,20210310,2021,03,10,2,라시엘루드,"다른 것보다 켜두지 않은 상태에서도 자꾸 상태창 뜨네요. 배터리 소모도 증가할테고, 백그라운드에서 계속 실행되고 있다는 점에서 찝찝하네요. 타사처럼 쓸 때만 실행되게 해주세요."
196,197,20211216,2021,12,16,1,HI K,"마이너스 통장 사용자를 위해 기존에는 출금한도 또는 이체한도가 나왔었는데 이번 리뉴얼 때 삭제되었어요. 통장 잔액 밑에 한도 좀 띄워주세요, 너무 불편해요. 앱 업뎃할 때 기존 기능에 대한 효능감을 좀 검토하시고 진행하세요. 이건 뭐 ux,ui 다 떠나서 기존 기능에 대한 검토조차 안했다는 게 너무 티나요."
197,198,20201228,2020,12,28,1,Kyojin Choi,구버전은 사용 불가예정이라길래 갈아탔는데 심플이체도 안되고...ㅡ.ㅡ;; 잘 쓰고있던걸 왜이런식으로 바꾸나요? 로딩도 오래걸리는데.... 최소한 심플이체는 가능하게 해주세요!! 그것땜에 하나은행 계속 사용하는데 새로운 앱에선 사용불가능이면 의미가 없네요.
198,199,20210303,2021,03,03,1,Hana You,앱에 메뉴가 참 카테고리설정 어이없어요. 상담직원들도 하나은행 거래안하는지 잘 몰라서 내가 일일히 설명해주고 이메뉴가 왜 여기 들어가있냐 민원넣어야하는 지경인데... 그것도 고마운줄모르고 상담직원 고자세에.. 그냥 조만간 은행갈아타는게 답. 아니 펀드에 추가입금한 내역이 펀드 관리메뉴에는 전혀안나오고 전계좌조회라는 메뉴에 따로 나오는게 어이없어. 그게 전에 업글되기전에는 한번에 다 나왔는데 업글된후 더 거지가됨.
199,200,20200531,2020,05,31,1,Yun Kim,별 한개도 아까워요. 멀쩡하게 원큐 앱에서 입출금 알림 받아서 잘 쓰고 있는데 쓸데없이 왜 어플을 또 만들어서ㅋ. 이것저것 필요없고 입출금 알림만 받으면 되는데 원큐앱에서도 되게 하고 다른 정보가 필요한 사람들은 알리미를 또 다운 받는 식으로 해야지 고작 입출금푸쉬알림하나 받겠다고 어플 깔고 인증하고. 인증도 드럽게 안돼요 창띄우게 만들어서 창 없애려고 뒤로 누르면 또 핸드폰 인증부터 다시 시작해야돼곸 진짜 어플 그지같이 만드시네요 그냥 없애세요~! 그리고 원큐앱에서 푸쉬알림 다시 되게 해주세요 이런거 필요없으니까
200,201,20210116,2021,01,16,2,김재용,"전에는 예약이체 기능이 있었는데 이번 앱에서는 계좌이체 -> 예약이체 체크 하도록 되어있는데, 더심플하게 하려고 한건 이해하겠는데, 계좌 잔액 없으면 예약이체 자체가 불가능한건 말이 안되지 않나요. 예를들면 25일날 월급이 들어와서 25일에 예약이체 미리 해두려고 하는데 지금당장 계좌에 잔액이 없으니 예약이체 불가능합니다. 이거 수정좀 해주세요"
201,202,20201003,2020,10,03,3,O-oji,계좌이체...송금기능 진짜... 너무 느립니다. 왜이렇게 만든건지 이해가안되네요. 먼저타이핑하고 송금전에 프로세싱하게 만들어야지 타이핑 너무 느리고 복사된 계좌 붙여넣기 기능도 제대로 작동 안하고 꾹 눌러서 붙여넣기도 안되고 밖에나가서 새로 복사해서 오느니 치는게 빠르고 은행어플 8개쯤 사용 중 인데 하나원큐가 송금은 진짜 최악입니다. 다른 은행 어플 아무거나 좀 보고 개선해주세요. 개발자? 개발팀님들? 능력이 없는건지 생각이 없는건지 모르겠네요. ^^
202,203,20210216,2021,02,16,1,phil hwang,"오픈뱅킹 잘쓰고 있었는데 왜 또 신분증 인증해야 쓸수 있나요? 그리고 신분증 인증하려고하면 자꾸 인식을 못합니다. 서로 다른 빛 환경, 반사가 없는곳, 배경이 어두운곳, 카메라 닦고 재촬영.다 안되요. 그렇다고 내 폰이 옛날기종도 아니에요. 재촬영 50번 실패하고 타은행 오픈뱅킹으로 넘어갑니다."
203,204,20200831,2020,08,31,4,이관태,"얼굴인식 로그인, 이전보다 심플해진 구성 좋네요. 거래내역이나 이체 화면에 기존에 있던 출금 또는 이체가능액 표시가 없어 불편해졌어요. 가능하면 다시 보이게 해 주세요.."
204,205,20200829,2020,08,29,5,BK Baek,"신규 메뉴 중에 '내자산연구소' 정말 좋네요. 다른 어플은 연금까지 제공하지 않는데 내자산이 빠짐없이 보여주네요. 그리고 지출도 카드, 현금, 은행 등 모든 내용이 파악 가능합니다. 막강한 기능 맘에 듭니다."
205,206,20200830,2020,08,30,1,최형선,주거래은행이라 핸폰바꾸고 3일째 다시하고 있는데 정말 스트래스 높이는 앱인 것 같아요. 여러번 설치를 다시했는데도 '네트워크오류로 정상적인 수신을 하지못하였습니다.'라고 나오는데 다른 은행어플은 바로되는데 이건 왜 오류가 계속되는지 모르겠어요. 이걸 어디에 확인해야하나요?
206,207,20210926,2021,09,26,2,ᄋᄇᄋ,"... 똥개훈련인가..요? 모바일 otp신청하고 신청확인하라고해서 했더니 정보가 맞지 않는다고 안돼고 정보수정하고 했는데도 똑같네요 그래서 그냥 모바일 otp재발급했는데 이번에는 신분증 인증이 문제를 일으키네요? 발급날짜, 이름, 주민번호까지 똑같고 흔들림,번짐,반사도 없는데 자꾸 다시하라고해요.. 참고로 저는 갤럭시 10s 5g쓰고 있어요"
207,208,20210105,2021,01,05,1,조은서,아니...하나은행 공인인증서 발급받았는데 타은행은 로그인이 되는데 왜 하나은행에선 공인인증서가 없다고 하죠? 진짜 희한하네요. 어플 지우고 새로 깔아도 없다네요. 진짜..이십년 넘게 쓴 하나은행(외환) 조만간 정리하려고합니다. 너무 불편. 은행어플 중 제일 불편.. 이체계좌 적는것도 더 불편해요.ㅠㅠ
208,209,20220224,2022,02,24,1,이지언,"은행어플 중 하나은행이 가장 구리다는 댓글에 박수를 절로 칩니다. 신앱도 제대로 평가해보고 풀었어야할듯. 로그인 후 계좌이체하려는데 보안매체 확인이 필요하다며 otp화면으로 넘어가서는, 비밀번호 넣으면 휴대전화번호가 다르다는 메시지만 무한 생성.. 수회 씨름하다가 제가 스스로 otp발급재발급 화면에 들어가서 해결했네요. 왜 자동으로 발급화면으로 안넘어가는거죠?"
209,210,20200909,2020,09,09,1,양승현,이전 구버젼 으로 다시 사용할거에요 하루 30건정도 매일이체합니다. 디자인은 좋아졌으나 자주쓰는계좌이체한때 계좌번호 수정이나. 기타 기능들 그리고 제일큰거는 너무 느려요 속터집니다. 더 업그레이드 되면 올께요
210,211,20181129,2018,11,29,1,Google 사용자,진짜...살다가 어플 리뷰처음 남기네요. 기존은행어플서 알람되던거를 머하러 알람 앱을 다시만든건지? 개발자들 능력이없는건가요? 아니 하나은행관련된 앱설치만 몇개입니까 진짜. 하다가 너무짜증나서 리뷰남깁니다. 기존어플을 대응하기쉽도록 개발하고 연구할생각은 안하고 고객생각 1도없이 그냥 어플 찍나요. 하...
211,212,20181122,2018,11,22,1,Google 사용자,"안그래도 입출금내역이 하루에 한번씩 몰아서 오더니 이젠 오지도않고, , 계좌조회때문에 하루에 몇번이나 어플 들어갔다나왔다하다가 열받아서 상담해보니 알리미 어플 깔라고,, 알림정도는 그냥 기본어플에 있으면안되나요?? 엄청난 기능과 새로운 내용도 없는것같은데,, 이러다 또 없어지고 통합하고 통합한거 또다시 설치하라하는건 아닌지,,"
212,213,20201013,2020,10,13,1,이윤지,어플 업데이트 이후로 네트워크 오류로 인한 문제로 접속이 되지않습니다. 다른 은행어플은 들어가지는 것을 보면 네트워크 문제는 아닌거같은데 앱 삭제후에도 같은 현상이 일어나 어플 사용조차 못하고있어요
213,214,20200217,2020,02,17,1,Google 사용자,끔찍하다... 카카오뱅크나 토스같은 수준은 바라지도 않고 앱을 겁나 나눠대는것도 다 그렇다 치고 넘어가도 앱 각각 개별로 놓고 봐도 그냥 난장판임 이 앱은 ui 디자인을 어떻게 했길래 인증과정을 이렇게 개판으로 해놨지? 체크박스 하나 체크하려면 약관 읽게 하는거 좋은데 하난 뒤로 버튼눌러야되고 또 다른건 밑에 동의함 버튼 눌러야되고 이거 통일안된것도 개판인데 실수로 동의함 해야하는걸 뒤로 가면 그냥 첨부터 다시 이름 주민번호 다 치고 다시 그 약관 체크박스질도 다시해야함 심지어 주민번호고 뭐고 앞에 숫자 다채우고 나서 뒤로 자동으로 안넘어가서 다 직접 터치해줘야함 진짜 거지같은 인터렉션 때문에 돈 다빼고 다른은행가게 만드네
214,215,20201105,2020,11,05,3,아이린티비,"기본 글자, 숫자크기를 조금더 크게해얄듯요. 제가 30댄데도 초기로그인 시 비번입력하는 숫자가작고, 남는공간도 많은데 굳이 작게해야하는지 모르겠네요;; 개발자는 직접 한번 사용해보시길 권합니다."
215,216,20210206,2021,02,06,1,J J,정말 별하나도 아깝다. 여기는 만들고 테스트 안해요? 10년 넘게 쓰고 있는데 이체 누를때 마다 창하나씩 떠서 헷갈리게하고 자주쓰는이체관리는 어디로 처박아서 등록도 힘들게 하고 순서 바꾸는거는 느리고 끊기고 저장도 안되고 화살표는 작아서 손으로 누르면 수정으로 들어가고요. 제발 또 개선하는라 돈 쓰지말고 전버전으로 쓰세요. 그 개발비 아껴서 손님들 대출이자 예금이자 혜택 주세요. 그리고 예전에는 검색하는데 단어 쓰면 관련된기능 나왓던거 같은데 지금은 돋보기 꼭 눌러야 하네요. 점점 기능이 낙후 됨
216,217,20201028,2020,10,28,1,서종건,간편비밀번호 설정하는데 도대체 왜 쓸데없는 제한을 걸어두는건지 모르겠어요. 같은숫자 사용못한다거나 생일 못쓴다거나... 이전의 하나 원큐는 그런 제한이 없어서 제가 원하고 기억하기 편한 비밀번호를 사용할 수 있었는데... 이거 때문에 하나은행 앱 이용이 굉장히 꺼려집니다.
217,218,20201220,2020,12,20,1,르꼬끄,퇴직연금 계좌로 조회 들어가면 로딩이 몇분걸리는건지..구 어플은 바로들어가지고 수익률이나 운영현황 정보조회시에 기간을 길게잡아서 조회하면 오래 걸렸는데. 신 어플은 퇴직연금 계좌들어가면 자동으로 처음가입날짜부터 최근까지 한번에 수익률등 정보를 가져오니 로딩이 오래걸리는게 아닐까요? 상품교체를 위해들어가는게 계좌정보 전체를 볼필요는 없잖습니까.
218,219,20211215,2021,12,15,5,Cy Kim,"제발 부탁드립니다. 업데이트 때문인지는 모르겠지만, 앱 내에서 입출금 내역란에 추가로 메모를 적어둘 수 있던 내역메모하기 버튼이 사라졌습니다. 메모를 따로 안해두면 언젠가 여기저기 뭐때문에 입출금 했는지 사방팔방 찾으러 다니기 때문에 저는 이 기능이 꼭 꼭 꼭 필요합니다. 제발 부탁드립니다 이 편리하고도 좋은 기능을 없앤 거라면 제발 돌려놔주세요 별도 5개로 드릴게요 제발 부탁드려요 꼭좀 부탁드립니다"
