,id,date,dateYear,dateMonth,dateDay,rating,userName,content
729,730,20220304,2022,03,04,1,멍뭉이하리보,최악입니다. 쓰고 싶은 기능을 고작 스크롤 할 수 없어 쓸 수 없다는게 어이가 없네요. 다른분이 쓰신 댓에 나온 답변대로도 다시 하나하나 다 해 보았는데 변함이 없습니다.
730,731,20201203,2020,12,03,1,Moonjung Chang,이체포기했어요. 누가 그많은 거래 업체 계좌를 다 외우고 있나요?검색으로 찿아서 바로 이체할수 있었던 구 버전이 더 좋네요.매번 pc로 할수도 없고..구버전 없어진다해서 새로깔았는데 하루에도 몇십번 이체하는데 이거 아주 난감해요~
731,732,20220127,2022,01,27,1,Seoulstation Kor,"금일 서울텍스에 전자세금납부하려다 다른 특정앱에서 트로이안 악성코드가 발견되어 세금납부가 거부되었습니다. 어제저녁까지 하나은행앱으로 이체를 했는데, 은행앱은 아무런 보안장치가 가동되지 않고 이체 되었습니다. 이러고도 해킹이 고객들 부주의때문입니까? 납부거부샷, 삭제후 정상납부샷 모두 모아놨습니다. 필요하면 드릴테니 답변바랍니다."
732,733,20201005,2020,10,05,2,Kristin CHEON,네트워크 연결문제라면서 접속 안 되는데요??? 저만 그런 게 아니라 다른 분도 그런 것 같은데 고객에게 어플 지웠다 깔았다 하라고 하지말고 자체적으로 고치세요... 이런 적 없는데 갑자기 이러니까 당황스럽네요
733,734,20200317,2020,03,17,4,Google 사용자,우리은행 알리미와 비교해 볼때 화면도 선명하고 기능도 간편합니다 하나 불편한점은 비밀번호가 다르다고 하면서 오류가 자주 발생합니다.
734,735,20180912,2018,09,12,1,Google 사용자,"회원가입, 로그인 조차 안되게 해놓고 앱을 릴리즈하시면 어떻게 합니까? 휴대폰 본인인증 절차에서 인증번호 받고 넘어가면 이상한 특수문자와 글자들이 나오고는 처리되지 않네요. 빠른 수정 부탁드립니다."
735,736,20200910,2020,09,10,1,왕혜영,별로예요 이체시 너무 불편해요. 계좌번호 복사 붙이기도 안되고 첨부터 전화번호 찍으라고 나오고 여러가지 불편합니다. 구하나버전 지웠다가 불편해서 다시 깔고 있어요
736,737,20210803,2021,08,03,1,jee hoon oh,통장개설부터 안됨. 운전면허증을 수십번 찍어봐도 다시 찍으라고 함. 다른 은행어플로 신분증 인증해봤는데 잘됨. 고객센터 통화해봐도 핸드폰 껐다켜보라는 답변뿐.
737,738,20220722,2022,07,22,1,민준tv Kevin,해외유심일경유 가입조차 안되네요 해외거주자는 어떻게하라고
738,739,20200705,2020,07,05,1,도순자,휴대폰 기기변경 후 어떻게 해도 로그인이 안됩니다. 다른 은행어플 다 되는데 하나은행만 안되네요. 계좌번호로 인증하려고해도 계좌번호인증단계 버튼부터 터치인식도 안되고 상당히 불편한 시스템이네요.
739,740,20200912,2020,09,12,3,D.H. Synn,구버전보다 많이 불편함 가장 일반적인 불편함은 구버전에서는 계좌 잔액과 출금가능액이 같이 표시 되어 줗았는데.. 새버전은 잔액만 표시되고 출금가능잔액은 이체에 들어가야 알 수 있어 관리에 불편니다.
740,741,20181127,2018,11,27,1,Google 사용자,"기존에 있던거 냅두고 왜이리 덕지덕지 붙여서 새로만드는지 노이해.. 있던거나 똑바로 관리하던지, 알림앱이 바뀌었다고 알려주던가 하지 제대로된 공지도없이 지들 멋대로바꾸넹"
741,742,20210112,2021,01,12,1,Yu JU SeRa,갑자기.로그인 방식 변경되고.늘 쓰던 방식..이렇게 불편하게 바꾸다니..나이 든 사람들 이렇게 변경하면 짜증남.심플이체도.없애고.패턴로그인 없애고.완전 짜증남..다시돌려놓기 ㅡ
742,743,20210414,2021,04,14,1,Roug E,얼굴인증 하라고 해서 할때마다 오류떠서 안된다 그러고 얼굴인증 해지를 했더니 또 얼굴인증을 하라고 하네요.^^ 해지했는데 어떻게 인증을 합니까? 지문인식 한번 하면 됐지 왜 얼굴인증을 또 하라는건지 모르겠네요. 안되면 비번이라도 치게 해주던가 무조건 안된다고 넘어가지도 못하게 하니 서비스이용이 전혀 안됩니다.
743,744,20210625,2021,06,25,1,최규영,타사앱 대비 너무 느린데 조회화면 좀 빠르게 전환되게 개선좀 해주세요. 할때마다 승질나서 타사앱 오픈뱅킹으로 잔고를 빼고 있습니다. 하나은행은 앱이 느려터져서 고객과 멀어져만 가는군요
744,745,20200927,2020,09,27,1,Hyunjin Jung,왜 이따구로 복잡하게 만들어놨는지모르겠네요... 진짜 전화번호 한 번 바꾸는데 뭐가이렇게복잡한거죠.... 제발..좀...다른은행어플 좀 써보시고 개선좀 해주세요 🙏 몇년째 이렇게 한결같이 답답하기 짝이없는 어플은 처음이네요. 어우...짜증나진짜
745,746,20220723,2022,07,23,1,장우제,비대면 통장개설에서 신분증 부터 모든 사항 다통과후 인증이 안됩니다. 삭제후 다시하려고하니 내나이가 50이 넘었는데 14세이하는 가입이 안된다고 뜨네요. 신협 새마을 금고 같은 2금융귄부터 농협 우체국까지 비대면으로 모두 만들었는데 하나은행앱은 참 그지같이 만들었네요. 왠만하면 글안남기는데 요즘같은 코로나시대에 앱관리를 이따위로밬에 못하나하는 안타까운 마음에 글남깁니다
746,747,20220721,2022,07,21,5,GoodIron,간단하고 편해요
747,748,20220722,2022,07,22,5,아쟈,사용하기 편리하고 좋아요.
748,749,20220719,2022,07,19,5,이영호,설치된 하나은행 원큐 엡이 왜 작동되지 않나요 ? 다른 은행앱은 모두 정상가동 됩니다
749,750,20220722,2022,07,22,3,송미남,앱실행은 열기로되는데 어플리케이션이 생성이안되요. 왜그런가요
750,751,20220803,2022,08,03,5,MayB오월비,알잘딱깔센 원큐에! 원큐에! 광고보고 써보니 좋네요 킹아!
751,752,20220805,2022,08,05,4,정지웅,계좌이체에 지방세입이 없어서 고생중입니다. 어서 추가시켜주세요.
752,753,20220719,2022,07,19,5,허승혁,편리하고 좋아요
753,754,20220803,2022,08,03,5,J.K.LEE LEE,편리하고 좋아요
754,755,20220722,2022,07,22,1,hyuntaek 84,알람이 가끔 씹히는건지 안오는데....왜그럴까요?
755,756,20220722,2022,07,22,1,셋들,가족의 카드내역확인해야하는데 내것만 로그인가능해서 가족의 카드내역확인이 불가능합니다 가족일원의 명의로 로그인 하는방법이 왜 없는거죠 불편해 불편해 짜증납니다.
756,757,20220720,2022,07,20,5,최원석,한도계좌해제하려고 공인인증서 비밀번호 입력하면 다음단계로 안넘어가요 업뎃해주세여
757,758,20220803,2022,08,03,2,이솔이,시황한스푼 푸시알람해지 방법없나요? 아무리찾아도 안보임..
758,759,20220727,2022,07,27,5,김선태,빨르고 인증이금방도서좋아요
759,760,20220802,2022,08,02,5,김채윤,은행에 방문하지않고 간편하게 해지&가입할수 있어서 좋아요
760,761,20220720,2022,07,20,5,성윤기,휴대폰예금 간단+예금금리추가 좋아요
761,762,20201016,2020,10,16,1,sw lim,otp 비밀번호 입력하래서 입력했더니 맞다 틀리다 결과도 안나오고..잘못 입력했으면 틀렸다고 얘기해주고 몇번 틀리면 잠긴다고 알려주는게 정상 아닌가? 계속 입력창 떠있길래 계속 입력했더니 그때서야 10번 틀렸다고 나옴ㅡㅡ앱 똑바로 만들어놓고 쓰라해야지..어이가 없어서..이체도 안되고..짜증나게 은행 또 가야겠네ㅆ..ㅡㅡㅡㅡㅡㅡㅡㅡㅡㅡㅡㅡㅡㅡㅡㅡㅡㅡㅡㅡㅡㅡㅡㅡㅡㅡㅡㅡㅡㅡㅡㅡ 답글 보고 다시 앱 깔아봄. 믿은 내가 호구ㅋㅋㅋ 이거 사진은 못올리나. 사기치지 마쇼. otp 발급 불가에 1원도 이체 안됨. 기존 사용자를 베타 테스터로 만드는 수준
762,763,20201009,2020,10,09,1,ms p,새로운 어플 느려요. 로그인 후 점3개만 계속 물결치다 사용자가 많거나 인터넷 불안정하다는 창이 뜨길래 폰 데이터 문제인가 했는데 다른 어플은 다 돼요....은행 바꾸고 싶을 정도예요
763,764,20210318,2021,03,18,1,김건우,재설치를 해도 계속 무한로딩이 걸리네요 급하게 이체해야할 때마다 다시 깔아야할 수도 없고 참... 답답하네요 답변 주신대로 해도 똑같이 무한 로딩현상 생기네요
764,765,20210307,2021,03,07,1,Gwangmo Seong,송금 할 때 앱이 강제 종료되고 비밀번호 처음부터 다시 입력해야 되는 게 이번에 두번째네요. 송금 한도가 안되서 오류가 나는 거면 오류 원인도 알려주면 참 좋겠습니다
765,766,20220525,2022,05,25,1,SJ MooN,돈좀써라 앱에다가. 회원가입했는데도 자꾸 가입하라고 뜨기만하고 따로 로그인 하는곳도 없고. 발로 만든건지 복사붙히기해서 만든건지 속터진다
766,767,20220324,2022,03,24,4,안재민,전 버전보다 앱 구동 속도가 빨라져서 좋네요.
767,768,20201211,2020,12,11,1,oy J,로그인이안됨..뭐어쩌라고... 그냥 간편비밀번호만 입력하면 앱자체가 꺼집니다 공인인증서로 로그인해볼래도 타행인증하래서 또 시도하면 꺼지고 인터넷에서 시도하려고 otp인증번호생성하려고 간편번호입력하면 또 꺼지고 그러네요
768,769,20181116,2018,11,16,1,Google 사용자,갑자기 입출금 내역이 오늘 부터 안보여서 한바탕 난리..언제 부터 안된다고 공지도 없었고..지금 개발자가 표방하는 app 서비스 간소화 차원은 더더욱 아닌거 같고. 계좌조회는 기존앱으로 하면되고 입출금 정보 알려줌 되는건데 기존에 sms 보다 이게 도대체 왜 추가로 필요한건지 설명좀 해주심..카톡으로 알려주는 카뱅 가야겠네
769,770,20180912,2018,09,12,1,Google 사용자,"회원가입이 돼야 뭘 확인하죠. ARS랑 비밀번호 등록까지 하고 완료됐는데, 로그인했더니 미가입자라고 나와서 한번 더 했더니 또 안되네요. 가입이 안되는데 어떻게 이용합니까 안그래도 메인앱도 알림안오고 앱 화면도 안나오는데 다른앱으로 잔액 확인하는게 더 쉽네요"
770,771,20180930,2018,09,30,4,Google 사용자,"알림이 푸쉬로 잘 오긴하나 입금된 금액이 안보여서 필요하면 로그인해서 확인해야하는 불편함이 있네요. 로그인안하고 알림온 푸쉬로 한번에 확인할수있게 두줄,3줄로 해서 보여주세요."
771,772,20220805,2022,08,05,1,이영진,하나원큐는 왜 이렇게 사용하기가 불편합니까? 다른 은행앱 좀 보고 오세요. 일부로 사용 못하게 만들어놓은 느낌
772,773,20201021,2020,10,21,2,동네주민,디자인이 깔끔해진것 같습니다. 그런데 아직 ui가 익숙하지 않아서인지 너무 불편합니다. 추가적으로. 속도 너무너무너무 느려요. 그리고 얼굴등록(인식을 못해요)이 안되요
773,774,20210426,2021,04,26,1,정다희,로그인 방식을 변경하려고 인증을 받으면 화면은 계속 안넘어가고 오픈뱅킹은 계좌가 다 없어져서 다시 등록하려하니 기등록 계좌라며 오류가 뜨고... 뭔가 아주 불편해졌네요
774,775,20210322,2021,03,22,1,woogie,최근 업데이트 이후에 앱이 안켜지고 자동으로 종료됩니다 확인 부탁드립니다 다시 깔면 그 때만 잘 접속되고 금방 먹통이 되네요
775,776,20200831,2020,08,31,1,김진환,로딩시간이 너무 느려요 뭘 클릭하든 기본 2~3초 걸리고 비밀번호치려고 숫자키패드 불러오는것도 이러면 답답해서 어떻게 사용해야할지... 하루빨리 고쳐주시면 감사하겠습니다~
776,777,20220128,2022,01,28,2,유리,"입출금 앱 푸쉬 왜 안 되나요? 계좌 출금은 뜨는데 카드 사용할 때, 계좌입금될 때 안 뜨네요 ㅠㅠ 이것 때문에 하나은행 안 쓰다가 다시 생각나서 썼는데 더 안 좋아지네요 ㅠㅠ +다 안 해보고 평점을 주었겠어요? 다른 사람들도 보는 공개글인데 ㅠㅠ 하나카드, 신용카드가 아니라 계좌와 연결된 체크카드이고, 앱 푸쉬 설정은 고객센터, 인터넷 등 다 검색해서 해 보았어요 ㅠㅠ 입출금 설정도 몇십번이나 들어가서 확인하고, 어플 재설치도 해보고, 알림 변경도 다시 하고, 푸쉬주의사항 그대로 따라도 하고.. 대체 어떻게 해야할지 모르겠네요 ㅠㅠ"
777,778,20201016,2020,10,16,2,노호찬,얼굴인식을 할수 없다고 자꾸 뜨네요 기존에 쓰던 홍채인식 인증은 왜 없는거죠 구버젼일때 아주 편하게 썼는데 신버젼은 아주 쓰기 까다롭네요. 홍채인식 인증을 포함해서 만들었으면 하네요
778,779,20220513,2022,05,13,5,Jen Cho,사용이 편하고 좋아요 은행상품이 더 다양해졌으면 좋겠어요
779,780,20200813,2020,08,13,5,조우궁환,"모든앱을 통합한거예요? 와우. 처음엔 이게머지 싶었는데.. 각 계좌별로, 쓸데없는 메뉴는 안나오고 이용가능한 메뉴만 나오네요. 개발하시느라 힘드셧겟어요"
780,781,20201115,2020,11,15,1,박정윤,아니 로그인 설정 자체가 아예 증발하듯이 날라가서 다시 간편로그인 인증부터 다시 해야 한다니까요;;댓글에 올려주시는 해결방법은 아예 다른 부분을 이야기 하시는데...업데이트이던지 뭐든지 좀 조치가 있어야 싶습니다
781,782,20201113,2020,11,13,1,Jung-Rim Kim,"크롬 업데이트, 다시 설치, 껐다 켜기 다 해도 타행 공인 인증서 증록 메뉴를 실행하몀 죽네요.. 은행 업무를 볼 구가 없으니 빠른 조치 바랍니다."
782,783,20210917,2021,09,17,1,최원호,어제 초기화 시켜는데 또 튕기네요. 다른 타 은행 앱 들어갔다 나오면 이런 일이 생기네요. 문제 많아요. 간편비밀번호는 괜찮은데요. 인증서 로그인만 하면 앱충돌이 심하네요. 제대로 된 업데이트를 부탁드립니다. 안 그래도 주거래 은행인데 이런일이 자주 발생하는 거는 너무 심하네요.
783,784,20201017,2020,10,17,1,Wongyeom Kim,기존거 잘사용하고 있는데 바꾸고 새로깔고 등록하고 또 구외환은행 계좌번호 보이지않고 왜이렇게 복잡하게 만듭니까...구외환계좌 번호 계속사용할수있나요?
784,785,20220108,2022,01,08,1,Wan Oh,"이번 화면 개편한 부서장은 명퇴하셔야될듯 메인화면의 대부분 버튼이 메뉴라기 보다는 마케팅 낚시질 느낌... 즉, 광 고 바 로 가 기 에요"
785,786,20211221,2021,12,21,1,jd angel,아예 로그인 안될 뿐만 아니라 계속 구슬 튕기는 시그날만 있을뿐 화면 자체가 넘어가지 않음. 로그인 화면도 뜨지 않음. 이런 앱은 아예 없는 것보다 못해.
786,787,20210808,2021,08,08,2,이정우,하나은행앱이 백그라운드에서 실시간검사를 진행합니다 구글플레이에서 다른앱을 설치하거나 업데이트할때 상태바에서 하나은행 실시간 검사가 활성화됩니다 하나은행앱을 사용하고 있지도 않은데 왜 자꾸 실시간검사를 하나요? 뱅킹앱을 사용하고자 앱을 설치한거지 휴대폰 관리프로그램을 설치하고자 한게 아니잖아요? 하나은행앱 동작중이 아닌 상태에서 보안프로그램이 작동하지 않도록 수정바랍니다
787,788,20210503,2021,05,03,3,THU TRANG HUYNH THI,설정에 들어가서 문자 알림을 하려는데 문자 알림이 안 눌려져요. 다른 건 거의 다 잘 눌려지던데요
788,789,20220729,2022,07,29,1,디타,회원가입 절차만 7번 밟았습니다 ㅋㅋㅋ 끝날때쯤에 오류뜨면서 회원가입도 못하게하네요
789,790,20201031,2020,10,31,1,DK L,결론만 말하면 별 하나도 아깝습니다. 쉽고 빠르게 개편했다고요?? 멀쩡히 쓰고있는거에서 바꾸면될것이지 뭐 하나하나 누를때마다 세월아 네월아... 한달에 한번 이체할때 말고는 절대 안씁니다
790,791,20210618,2021,06,18,3,Jiny Yoo,와이파이에서 안된다하여 와이파이를 끄고 데이터사용중인데도 계속 동일한문구로 작동이안되고 지웠다 다시 설치를 하네요ㅠㅠ
791,792,20210409,2021,04,09,1,쟁탱튜브-비공개,지금 앱이 안된지 며칠 됐어요. 지웠다가 새로 깔아보기도 했는데 몇번되더니 이제는 아예 튕겨요.. 갤노트10+ 쓰고 있습니다.. 폰 업뎃은 다 되어있는 상태에요. 쓸 수가 없어서 많이 불편해요ㅠ
792,793,20220320,2022,03,20,1,김한빈,예전엔 앱 실행하면 바로 지문인식 창 떴는데 업데이트 후 로그인 버튼을 한번 더 눌러야되네요.. 너무 불편합니다 그냥 앱키자마자 로그인할수 있게 해주세요 자동로그인은 안씁니다
793,794,20200622,2020,06,22,1,K쩡,장난하는것도 아니고 가입하는것도 뭣같이 만들어냈네 기본 입출금 받는걸 왜 별도로 깔아야됩니까 계속 안온다고 했더니 다른은행으로갈아타던지 별 혜택도 없으면서 어플만 오질라게 많이도 만들어났네 이용자가 편하게 만들지는 못할망정 오만상 더 불편하게 만들고 아주 자알 운영하고 계십니다.
794,795,20210221,2021,02,21,1,안영태,어플 접속이 안되고 종료되네요 삭제후 재설치해보아도 비행기모드로 30초간 해보아도 안됩니다 확인바랍니다
795,796,20200917,2020,09,17,1,Ocean Blue,업데이트가 필요하면 업데이트로 진행을 하던가 아니면 제대로 안내메세지가 나오게 하던가.. 갑자기 앱 먹통이고 로그인 안되고.. 운영하는 것이 참...
796,797,20200817,2020,08,17,5,김영훈,전보다 더 좋게 업그레이드 되었네요.. 이체도 쉽고 자산내역을 한번에 볼수있어 좋은거 같네요. 쿠폰같은것도 할인해서 사고.. 노력한 흔적이 보입니다
797,798,20210625,2021,06,25,1,dr. Ryu,공과금 들어갈때마다 속터져 죽겠네요. 한번에 바로조회는 빨리 되어야 편리한거지 최소 2~3분씩 기다려야 넘어가는데 이걸 도대체 어떻게 쓰란건지... 구 뱅킹앱처럼 그냥 골라서 조회하게 좀 해주세요.
798,799,20201219,2020,12,19,2,opera,자꾸 렉 걸려요 다른 항목 클릭할때 점 세개 똥똥똥...없었으면 좋겠어요 다른 은행들은 안그런것 같은데 오픈뱅킹등록할때도 계속로딩되어강제 종료했고 펀드계좌조회할때도 계속 로딩되어 왕 짜증났어요
799,800,20201110,2020,11,10,1,배우철,"다른 앱과 연동성이 너무 떨어집니다. 뱅크샐러드 앱에 등록하려니, 다른 은행계좌는 자동으로 다 되는데 하나은행만 앱 깔아라 아이디 만들어라 타은행 공인인증서 등록해라.. 다 하다가 시제는 모바일 OTP까지 깔라는데 또 대상고객이 아니라네요. 진짜 화나네요 하 참"
800,801,20220726,2022,07,26,5,박쑹,늘 이용해요 좋아요 새로운기능도 많네요
801,802,20210324,2021,03,24,1,몰리제이,앱 종료시 팝업창 일부러 꺼지게해서 광고 클릭 유도하나요?이런걸 제보해도 고칠 생각을 안하는건지 못하는건지 좀 한심?하네요. 금융어플이라면 좀더 빠른 대처가 필요하다고 봅니다
802,803,20210401,2021,04,01,1,jp las,"2021.3.22.일자 업데이트 내역엔 ""기타 사용성 개선""이라고만 덜렁 쓰여있네요. 너무 무성의 무심하네요. 업데이트 내역 상세히 꼭 써주세요. 금융앱은 투명해야합니다."
803,804,20220208,2022,02,08,1,김나현,핸폰으로 통장만들으려고 신분증 찍었는데 진위확인불가라고하네요 운전면허증이고 제대로 찍었는데 왜 확인이 안된다는건지.. 그래서 상담전화했는데 상담하시는분들이 많으신가봐요.. 상담원 연결이 안되네용..ㅠㅠㅠ
804,805,20210331,2021,03,31,1,Nevermind,"언제 부터인가 입출금 알림이 전혀 오질 않습니다. 설정 건드린적 없고 알림계좌 삭제 후 다시등록, 백그라운드, 절전, 앱 설정 알림 모두 정상적으로 만져 놨는데 안됩니다."
805,806,20210826,2021,08,26,5,김난희,"적금 가입할때는 편한데, 적금 여기저기 확인할때 뒤로 나가면 로딩이 새로 되어서 느리네요! 개선되면 좋을듯 합니다."
806,807,20200826,2020,08,26,1,아이비파큐,"업데이트이후 입출금내역 알림이안와요 앱 지우고 다시깔아도 알림푸시가 안옵니다 어떻게해야하나요? 앱에서 푸시동의, 입출금알림 계좌등록되어있고 앱설정도 알림동의되어있습니다"
807,808,20201208,2020,12,08,4,Amy JEONG,"하나은행, 하나카드, 하나카드(앱카드) 모두 아이콘이 1Q로 되어 있어서 구분이 잘 안되고 너무 같아서 자꾸 다른걸 누르게 됩니다 구분있게 특색있게 잘보이게 수정되면 더 좋겠습니다"
808,809,20200826,2020,08,26,2,최수진,마이너스통장인 경우 출금 가능 금액이 바로 표시되어 있지 않아 너무 불편합니다 기존 어플은 입출금 알림이 안되게 바꿔져 있고 ㅠ 짜증나네요
809,810,20220804,2022,08,04,5,ᄎᄋᄐ,선량한 시민이 광고한 그 앱!
810,811,20200821,2020,08,21,4,박연숙,"회원가입 단계축소, 자동로그인, 이체 화면 정리 다 좋은데 업데이트가 아니라 새 앱을 만드셨네요.. 왜그랬을지 이해가 가서 안타깝네요..ㅎㅎ 사용성 좋아져서 만족합니다. 다음은 업데이트로 리뉴얼 해주세요... 제발~"
811,812,20200202,2020,02,02,1,Google 사용자,정말 업데이트 하기 겁나네요... 앱 업데이트만 하면 알림이 안되고 앱에서 알림내역 검색도 안되는건 참... 이럴거면 업데이트는 왜 하는 건지...
812,813,20200915,2020,09,15,1,김정태,아니 왜 멀쩡한 어플을 바꿔버려서 계좌번호 복사붙여넣기도 바로 안되게 해놨나요 직관성은 없어지고 붙여넣기 메뉴있어도 오류나서 이체도 안되니 붙여넣기도 안되고 이체도 자꾸 오류나고 전에는 없던 문제가 왜이리 생기는지 이게 무슨일인지
813,814,20211211,2021,12,11,1,K k,앱이갑작스럽게 실행이안됨 와이파이나 데이터문제라고뜨나 다른어플은 실행이잘됨오류로 인한것추정 지웠다깔아도 동일한문제발생 주말에도이용해야하는 은행어플이 오류가나서 안되는게 너무불편하네요 적금이며 이체해야하는데 실행이안되어 너무실망스럽습니다
814,815,20201026,2020,10,26,4,정재택,궁굼한게있는데요 홈메인화면에 지정계좌 설정을 바꾸려면 어찌해야하나요? 자주쓰는계좌를 먼저뜨게 하는방법이요 아직 익숙치가 않아서 불편하지만 먼저것보다 훨씬간편하고 좋네요
815,816,20181126,2018,11,26,1,Google 사용자,아니 정말...저에꺼 놔두고 왜 또 만들어서... 하나만해요 하나만! 나름 하나은행 어플이 빠르고 간편하게 잘 만들어진것 같아 사용을하고 있었는데... 이럼 다른은행보다 나을게 뭡니까? 간편이체기능을 만드셨음 그냥 원래어플에다 넣어주시던지...암튼 이건아니외다!
816,817,20181023,2018,10,23,5,Google 사용자,딱 원하던 앱이네요... 지금까지 이런앱이 있는줄 모르고 뱅킹 접속해서 확인하고 얼마 지나지 않아 다시 인증해서 확인했는데 번거로운 인증절차가 없으니깐 너무 편하네요...
817,818,20190518,2019,05,18,2,Google 사용자,알리미앱이면 계좌입출금 뿐만아니라 신용카드 승인내역 알림도 추가해주세요 그리고 어플이 너무 많아요 축소 좀 했음 하네요 기존어플에 기능을 추가하면 되지 어플을 늘려놔서 불편해요
818,819,20201226,2020,12,26,1,하이브리드,인터넷뱅킹시 모바일 otp가 필요한데 앱으로 로그인이 강제로 되면서 인터넷뱅킹이 로그아웃 당해버립니다. 하나은행 2005년부터 썻지만 정말 이용편의성 최악입니다. 돈다빼서 국민이나 신한으로 갈아탈예정입니다.
819,820,20220711,2022,07,11,1,Jungyong Park,"하나합 가입하려고 인증이랑 간편비밀번호까지 등록하고나면 ""고개님은 조회만 가능한 회원이시거나 해외IP차단서비스(해외에서 거래불가)을 신청하신 고객님이십니다.""라고 뜨면서 처음으로 돌아갑니다"
820,821,20220610,2022,06,10,5,류혜영,편리하고 유용합니다
821,822,20220605,2022,06,05,5,yongbae kim,너무 좋아요.앞으로도 계속 이용하겠습니다.
822,823,20220710,2022,07,10,1,뮤길,청년주택내일저축인가 뭔가 만들려고 들어갔더니 인증서가 없어서 만들려고하는데 군대안에서 인증서 만들기 서럽게 만들었더군요. ARS는 카메라땜에 안돼 스마트 간편인증? 허 인증 요청을 하면 넘어갈 생각이 없는데 군대 안에 있는 사람은 뭐 만들지 말라는겁니까?
823,824,20220613,2022,06,13,1,김재용,무한로딩에 에러 계좌 한도 해지 안되고
824,825,20220531,2022,05,31,5,유정현,언제나 평안히 사용하고 어럽지 않아서 좋습니다
825,826,20220606,2022,06,06,5,Good,편리하고 좋아유
