,id,date,dateYear,dateMonth,dateDay,rating,userName,content
446,447,20200812,2020,08,12,5,조한종,전에 비해 앱을 실행하는 절차가 심플해졌네요. 초기 화면도 엄청 깔끔해지구요. 인뱅 앱보다 더 사용하기 편하고 재밋을 듯~~
447,448,20220614,2022,06,14,1,누구세여,입출금 푸쉬 알람은 왜 안되나요? 재설치해도 그러네요.
448,449,20201007,2020,10,07,1,서동철,삼성 Dex 모드에서 앱 실행>간편비밀번호 누르면 앱 종료되는 문제 개선이 필요함.. 될거라 믿지도 않았지만 안내 한 내용대로 해봐도 여전히 앱이 종료됨.. 재현 테스트는 해보고 안내하는 건지..
449,450,20181021,2018,10,21,1,Google 사용자,"진짜... 하나은행 회사 주거래만 아니면 옮겼다., 저기요...개발자님이든 분석 설계하신분들아... 가입을 휴대폰으로만 쳐해놓으시면 명의가 다른사람으로 되어있는 사람은 쓰지말란건가요. 기존 푸쉬알림 어플은 잘썼는데 이어플로 기능이관된뒤로 사용할 방법이 없네요"
450,451,20210824,2021,08,24,1,현은하,제가계속하나원큐지문인증으로하고싶은데안된다고지문인증등록하려해도안된다고문의드렸는데못알아듣겠다고하셔서전화로도문의해도원인들을파악못하시더라구요입출금알림도설정되있는데오지도않고..결국엔제가고민하다알아냈습니다저는거래내역조회만되게되있었고폰뱅킹신청안해놓은상태였거든요이걸안했었기때문에지문인증기능을사용못했던겁니다제가굳이여기쓰는이유는앞으로저같은비슷한문의들어올시폰뱅킹가입해야사용할수있다라고안내해주세요!
451,452,20220321,2022,03,21,1,Jihye Kim,서비스 종료 창밖에안나와요 10번들어가도 무한반복...짜증나네요...
452,453,20200902,2020,09,02,1,아무것도안함,"UIUX 및 디자인은 정말 개선된 거 같은데 LTE, WIFI 환경에서 다 사용을 해보았는데 너무 느립니다.. 카뱅에 비해서 너무 느려여 속도개선좀요.."
453,454,20201025,2020,10,25,1,S.K Lim,빠른이체가 없어진게 너무 불편합니다. 이전 보낸 내역이 그대로 뜨던게 도움이 됐었는데... 이전 버전 뱅킹어플이 더 편리한거같네요 UI도 더 불편...
454,455,20201230,2020,12,30,3,inwoo,전버전에 있었던 빠른이체기능이 안되는데 빠른이체 기능은 아예없어진건가요? 메뉴 아무리 찾아도 없네요. 전보다 기능이 더불편해진거같아요
455,456,20200915,2020,09,15,1,BKT,"핸드폰 바꾸면서 간편로그인 등록하려는데 얼굴인식, 간편번호 모두 계속 계속 오류가 나요 ;;;;; 얼굴은 인식을 못하고, 간편번호는 처음 누르고 두번째 누를때는 안넘어가네요;; 새로운 버젼 만들땐 충분히 시험하고서 배포했으면 좋겠네요"
456,457,20200825,2020,08,25,1,뽀나,"앱을 새로 출시하려면 오류가 없는지 검토부터 충분히 하고 출시를 해야죠. 로그인설정 바꾸는데만 앱 2번 재실행하고, 뭐 하나 수정하려면 다음 화면으로 넘어가는데 한참을 기다려야 뜨고 이럴거면 기존앱을 재활용하세요."
457,458,20181121,2018,11,21,1,Google 사용자,적당히 합시다. 개발자 일을 개떡같이하네 물론 시켜서 한거겠지만 뭐하러 1에서 2로 3으로 가는건지 모르겠네 이러다 기능하나하나마다 새로 깔게끔 시키겠네요. 알림 인터페이스도 적응안되게 수정하고 ㅋㅋㅋㅋ
458,459,20201013,2020,10,13,1,구길회,"1. 공인인증 로그인 시에 자판 색깔이 검은 것이 거부감을 일으킵니다. 설정에서 하얀색으로 바꿀 수 있게 만들어 주시오. 2. 종료시에 (강제 종료이거나 로그아웃 종료이거나 ), 보고있던 화면을 전부 지워서 ""최근사용한 앱""을 조회할 때 잔액 등이 표시되지 않도록 만들어요. 3. 전에도 지적했지만, 은행믜 광고성 홍보 화면이 너무 넓으니 홍보 부분을 좁게 바꾸고, 고객의 편의를 먼저 생각하도록,...."
459,460,20200907,2020,09,07,1,유기호,"은행을 옮기기로 맘먹게한 결정적인 계기를 만든 앱이다. 조회도 불편, 심플이체도 불편. 인터페이스도 불편하니 느리게 느껴지기도 한다. 편하게 볼수 있는게 거의 없음. 안녕. 난 카뱅으로간다."
460,461,20210318,2021,03,18,2,Ander,적응중이긴 한데 심플이체 어디로 갔나요? 기존 사용할 때 편했는데 없어져서 많이 불편해요. 심플이체는 이체내역을 그대로 재 사용이 가능해서 편했습니다!!
461,462,20201028,2020,10,28,2,wounsouk Choi,펀드계좌수익율 표시에서 구버전은 총금액에 대한 표시가 되어 변동을 확인하기 편했는데 새버전은 금액만 표시될뿐 각 계좌를 일일히 확인해야하는 불편함이 있네요. 보기쉽게 수정 요청합니다.
462,463,20201010,2020,10,10,2,김민지,계좌이체 시 얼굴인증 말고 지문인증은 안되나요? 구 버전에서 지문인증으로 편하게 쓰고 있었는데 바뀐버전에서는 안되는거같네요. 화장도 안하는데 얼굴인증도 제대로 인식되지 않아 얼굴인증으로 이체 성공한적이 없네요. 구버전도 11월로 종료된다 하는데 지문인증을 가능하게 해주시던지 구버전을 지속 사용가능하게 해주시던지 해결부탁드립니다
463,464,20210107,2021,01,07,1,YoungGon Choi,이체가 불편하고 이전 버전에서는 펀드의 경우 추가매수가 쉬웠는데 업뎃 후에는 계좌번호를 외우고 있어야 하는 등 사용하지 않을 기능은 많아지고 정작 자주 사용하는 기능은 어렵고 칮기 힘들어져서 예전버전으로 돌아가고 싶으니 예전버젼 올려주세요
464,465,20220814,2022,08,14,1,남현식,언제부터인가 아예 안 열려요. 업데이트도 다 했는데 이거 왜 이럼?
465,466,20200824,2020,08,24,5,daeun,오랜 하나은행 사용자로서 이전 홈 화면에 비해 훨씬 직관적이고 좋아요. 이전에는 기능을 쓸 때마다 서로 다른 버튼을 눌러 들어가야 했어요. 정말 불편했는데 지금은 좋아요. 귀여운 일러스트도 맘에 들어요~
466,467,20200901,2020,09,01,5,Mira Kim,화면이 깔끔해서 보기 편하네요 주로 이체를 많이 하는데 전보다 사용하기 편합니다. 얼굴인식 해야하는거에 대해 처음엔 거부감이 좀 있었는데 사용해보니 편하긴합니다. 그리고 사진을 저장하는방법이 아니라 사진유출에 대한 걱정이 없어서 안심하고 사용하고 있습니다
467,468,20220718,2022,07,18,1,HR L,계좌 해지 하려는데 인증이 필요하대서 하면 DBIO 호출 오류라고 계속 안되네요...
468,469,20200815,2020,08,15,4,Yong Shin,이번에 업데이트 되면서 하나로 통합한건 좋은데 입출금 푸쉬알림올때 금액이 잘안보입니다. 예전엔 금액 상관없이 바로 알림으로 보였는데 이제는 금액이 만원이라면 10.......이렇게만 보여서 들어가서 확인해야하니 불편해졌어요 이것만 예전으로 돌려줫으면 좋겠습니다.
469,470,20220422,2022,04,22,4,M N,"타은행보다 어플 이용이 편리합니다. 가볍고, 직관적이에요."
470,471,20180913,2018,09,13,5,Google 사용자,직관적인 인터페이스가 돋보이네요. 세세하게 정성을 많이 들인 앱이군요. 스마트폰뱅킹에 로그인하지 않아도 쉽게 확인할 수 있어 좋아요
471,472,20200812,2020,08,12,1,jerry lee,"당연히 합쳐야했을 알리미 통합 외에 기존 앱보다 나아진게 하나도 없으며 오히려 단점만 늘음. 가시성 떨어지는 버튼들, 얼굴인증 강제, 확실히 늘어난게 느껴지는 광고면(금융상품, 대출, 카드) 개편한다고 기대한 내가 바보였다"
472,473,20220703,2022,07,03,1,나추,이벤트로 가입하고 자산연결하는데 무한로딩으로 30분지나고 보상안 주고 강제가입시킴ㅋㅋㅋㅋㅋㅋㅋ 진짜 별로네요 탈퇴하는 방법이나 알려주세요 다신 안 쓸거니까
473,474,20220602,2022,06,02,5,Shin신재경,단계별로 이용이 쉽습니다
474,475,20211102,2021,11,02,4,big kelvin,은행업무를 다루는 앱이 실행하자 마자 DBIO에러를 내고 크래쉬 되어버리고 지문 로그인 사라저 버리고 많이 실망 스러웠습니다만. 빠른 복구 능력에 좋은 점수를 드립니다. 다만 지문 인식은 복구가 안되었네요 차분하게 복구 부탁드립니다
475,476,20220303,2022,03,03,3,고영도,스크롤이 안돼요. 아래 다른분 리뷰 댓글을 보고 android system webview를 강제 중지(업데이트 삭제가 없음) 했는데도 스크롤이 안돼요. 기종 노트8이고 OS는 안드로이드9 입니다.
476,477,20220811,2022,08,11,1,Lovely Grace,계속 다운되고 설치하라는건지 말라는건지 모르겠네요ㅜㅠ
477,478,20211229,2021,12,29,1,m KIM,"계좌 만드는 페이지 ui 중 하나가 최적화 안됨(폰뱅킹 지정 전화번호 하단 '신청안함' 부분 글자 겹침). 만들고 타행으로 첫 이체하려는데 모바일 otp 오류나서 안됨. 어플에서 콜센터 버튼눌러 전화하니 하나원큐 관련 부서 아님. 하나원큐 관련부서 연결 후 계좌번호를 말해달라함...아니, 갓 가입했는데 계좌번호를 어떻게 외우나요...(물론 기다려주신다고 하긴했는데 그렇게까지 불편하게 문의하고 싶진않았어요...)프로세스 정비가 필요해보이네요.. 타사는 계좌 못 외우면 이름 주소 핸드폰번호라던가 불러줘서 본인확인 후 계좌번호 찾아줍니다. 여긴 아니네요.. 어플 다운받아서 첫 이체에서 오류나면 사람들은 이 어플 안쓰죠..qa늘리셔야합니다.. Otp오류난거 해결하려면 신분증을 또 찍어야하고..콜센터에도 투자하시기 바랍니다. 처음에 예금부서에서 전화 받았는데 어플 관련부서 연결이 안되자 제 전화번호 불러주는거 받아적는거 같던데.. 타사는 화면에 핸드폰 번호가 뜨는 시스템인데.. 글자 제한"
478,479,20200831,2020,08,31,1,흠냐아,한번 하면 될 걸 여러번 하게 만들고. 신청하는 것도 입력을 다 했는데 다음버튼이 없고. 뭔 절차는 휴대폰인증이라든지 중복되는 게 많은 거 같고. 접근성이 떨어집니다. (폰 기종은 s20+)
479,480,20190918,2019,09,18,1,Google 사용자,아니 무슨 알리미가 알림 울리지도 않고 혹시나해서 설정가봤는데 입출금 모든거래 알림 했는데 알림 울리지도 않고 내가 로그인해서 확인해봐야하고 아 진짜 만들려면 제대로 만들던가 이따위거로 만들꺼면 뭐하러 만들었수? 그냥 내가 통장거래 확인해보는게 훨 낫겠네 거래내용 알림 되지도 않는거 그냥 프로그램서비스종료하쇼 짜증나서 주거래 은행 하나에서 신한으로 옮길라요 10년간 주거래로 이용했는데 신한솔알리미는 한번도 안빼고 다 알림 울더만 .. 신한은행으로 갈라요 프로그램도 하나 손 제대로 못쓰는곳이랑 거래 끊을라요
480,481,20201016,2020,10,16,1,김경산,"너무 불편한데... 일단 구 하나 원큐 대비 동작이 느리구요, 구 하나원큐는 빠른 입금 할 때 내가 작성한 내용이 한눈에 보이는데 신 하나원큐는 이걸 단계별로 나눠놔서 불편함이 있네요."
481,482,20201207,2020,12,07,3,설은빛,로그인할때에 자판에서 재배열을 누르면 입력한거 다 지워지는 거 고쳐주세요.. 보안이나 터치의 어려움때문이라도 재배열 누르는 사람 있는데 다 지워져 버리면 어떡하나요. 너무 불편합니다.
482,483,20201018,2020,10,18,3,김형원,"이체할때 구버젼에서는 다른 페이지에서 계좌 번호를 복사해 와서 붙여넣기가 되었는데, 이번 버젼은 안되네요. 많이는 아니지만 조금은 불편합니다... 혹시나 저만 그런건가요? 폰 기종은 스카이 아임백입니다. 아예 계좌번호 복사 붙여넣기 기능을 없앤거라면 이유라도 알았으면 하네요."
483,484,20200822,2020,08,22,1,이용광,"저도 오죽 답답해서 리뷰남깁니다. 기존 하나원큐 사용하다 갑자기 입출금푸시알림 없어졌구요. 그기능되게 중요한건데 얼른 원복좀 시켜주시고, 입금할때 공인인증서만 있으면 소액송금 가능했는데 이기능 없어졌고 무조건 OTP 사용하라 나옵니다. 너무 불편해요. 디지털시대에 맞춰 반대로 불편해지는 느낌입니다. 1. 입출금알림서비스 2. 송금시 OTP 입력 대신 인증서 얼른 보완해주세요"
484,485,20201111,2020,11,11,4,Sky papa,개인사업자로 구하나원큐에서는 국세납부가 편하게 조회납부가 가능하였으나 새로은 앱에서는 이체도 편하게 개선되고 공과금 클릭시 별도 조회없이도 납부해야할 국세 지방세 갯수가 표기되고 지방세의 경우는 클릭시 바로 납부가 가능하나 국세납부시에는 본인이 아니라고 오류 뜨고 별도 화면으로 조회 납부만 가능하게 만들었네요 사업자통장으로 개설하는 경우는 주민번호와 사업자번호를 같이 인식하게 하거나 최초 한번의 동의로 연동이 가능하게 기능이 개선되었으면 합니다.
485,486,20220813,2022,08,13,5,윤광원,정말좋다는말뿐 달리말할게없어요
486,487,20201230,2020,12,30,1,김수진,와이파이로는 어플이 안들어가져요 다시 새로깔고 들어가도 마찬가지구요 와이파이 잘터지는데도 안들어가지고 데이터를 켜야지만 작동이 됩니다 다른 은행어플은 와이파이로도 들어가지는데 왜 하나원큐만 그런가요
487,488,20200909,2020,09,09,5,나도나도,구버전도 잘 쓰고 있었는데 신버전 나왔길래 깔아서 쓰고있어요 구버전도 꽤 편리했는데 신버전은 거기에 플러스알파해서 더 좋아졌네요 자동로그인도 정말 편해요 예전에 비해 앱하나로 대부분 업무를 다 할 수 있어서 좋아요:)♡
488,489,20220508,2022,05,08,1,오혁준,해도해도 계~속 오류뜬다~ 계~~속 초기화면으로간다 진짜 왜이래요 이거?! 진짜 답답해 죽겠어요!
489,490,20210213,2021,02,13,1,구경민,다른은행 계좌 조회가 오류가 계속 뜨네요 추가하기 눌렀을때는 제대로 정보를 가져오는 것 같은데 조회 화면에서는 조회 오류가 뜨네요... 또 이체할 때도 오류 간간히 뜨고 새로운 버전이 전버전보다 오류도 많고 이렇게 불안정하니... 안정화에 힘써주길 바랍니다
490,491,20220220,2022,02,20,5,서정현,요즘에 비대면에 있어 최고인것 같숩니다. .초보자라도 쉽게 활용할수 있어 너무 편핮니다. .감사합니다.
491,492,20220303,2022,03,03,2,JP YOU,"안녕하십니까? 하나1Q 사용자 입니다. 3월부터 사용하는데, 스크롤이 안되어 입출금 내역이나, 각 계좌현황을 볼 수가 없습니다. 2월까지는 문제가 없었습니다. 펀드 입출금을 해야하는데, 안됩니다. ㅠ 도와 주세요. 앱 리뷰 댓글에 있는 WebView 내용을 모르겠습니다. 저는 Sony 엑스페리아 XZ1입니다."
492,493,20220330,2022,03,30,1,김민주,금융인증서가 이미 등록이 되어있는데 대출한도 조회시 계속 인증서가 있어야한다고 뜨네요 otp 도 등록되었구요 업데이트 완료했고 뭐가 문제죠?
493,494,20220222,2022,02,22,1,sweetone567,"진짜 최악인 은행어플ㅡ5시간을 어플을 돌렸는데 어느일정단계(문서 스크래핑)만 되면 어플이 자동종료 돼서 처음부터 또 시작해야함ㅡ은행에서 하다가 집에 와서 5시간째 되니 이게 사람이 할짓인가, 너무 열이 받아서 인내심의 한계가 이런건가 싶었음. 다른 은행 어플들 다 인식하는 인증서 여기만 안돼서 pc 켜고 가져오기 했다가 가져 왔는데도 또 없다고 해서 또 가져오고, 금방 얼굴 인식 등록, 간편 비밀번호 등록해도 또 처음보는 사람 대하듯 다시 설정 하라고 휴대폰 인증부터 초기화 시킴! 휴대폰 두대에 한대는 스크래핑에서 계속 오류나서 안되고, 전화로 문의하니 정부24 어플 가입해서 인증서 등록하라 해서 대기자 38명을 기다려 통화 후 pc켜고 가입 후 인증서 등록까지 했건만...한대는 스크래핑 단계에서 어플 자동종료 수없이 됨! 그냥 이유도 없이 종료 돼서 홈화면으로 이동! 내가 컴맹인가ㅡ못하는건가 자괴감과 인내심의 한계로 멘탈이 나갈 지경ㅡ 심지어 나는 컴터 보안 전공이다!"
494,495,20201023,2020,10,23,5,도치패밀리#일상,"리뷰 잘 안쓰는데, 이번 앱 잘 나온거 같아서 몇자 적습니다. 10년동안 하나은행, 카드의 다양한 앱을 사용했는데, 이번 앱은 담당부서에서 힘 빡주고 만드신거 같네요. 제가 원했던 기능들과 UX가 적용되어서 무척 맘에 듭니다. 카드내용도 확인가능하고, 송금시에 UX도 좋고, 한 화면에 확인가능하고, 최대한 단순화 하려는 노력 등등... 여러모로 잘 만든 거 같네요. 앞으로도 좋은서비스 부탁드리고, 담당자님 수고 많으셨습니다."
495,496,20210115,2021,01,15,1,고은혜,다른 분들 말씀처럼 간편인증 초기화.. 제 명의 아니고 동생명의 핸드폰 쓰는데카드인증이나 계좌로 인증도 안되고 다시 등록하려고 했더니 하다말고 계속 첫화면으로 넘어가고 인증서 만료기간이라 갱신하고왔더니 재등록하라고하고 등록하려니 통신사인증하라고 하고 이대로라면 저는 평생 이 어플 접속못하겠네요^^
496,497,20211027,2021,10,27,1,Lee진우,"내 전화기가 이상한건가..? 아님..앱에서 그러는건가 화면이 안열리네..? 하고 물으니..답장이..참..어이가읍네..이양반들아 그래 내폰은 갤럭시 s4 인데..여기서 전화기를 봐꾸라고..? 어느날 잘되다 업로드하니 접속이 안되서 뭐..소프트웨어를 업로드하라고..? 소프트웨어를 업로드 안하는 이유가 삼성축에서 원격터치해서 전화기가 망가지고,이상해져서 A/S 를 몇번이나 갔다와서 겨우 고쳐놨더니..여기 뭐..폰을 봐꾸라고요..?😈😈😠😠😬😬😤😤"
497,498,20200825,2020,08,25,3,CY Kim,계좌이체할때 얼굴인식말고 지문인식이나 간편비밀번호로 하고싶은데 무조건 얼굴인식먼저 시도해서 마스크쓰고있는데 너무 불편해요. 기본 설정을 지문으로 하고싶은데 설정을 뒤져봐도 없는지 못찾겠어요
498,499,20210802,2021,08,02,1,yj,ui가 너무 안좋습니다. 주업무로 은행쓰는데 그룹사별 여러가지 메뉴가 너무 많고 쓰지도 않는게 많아서 복잡함. 직관적이지 않고 너무 불편함. 여지껏 구형 하나원큐가 편해서 억지로 그것만 쓰는데 알림도 요즘 안오고 로그인도 일부러 버벅거리게 하는건가요? 아 진짜 그냥 구형 하나원큐처럼 가볍게 한가지만 합시다 좀.
499,500,20210116,2021,01,16,1,K Min,"공인인증서로 로그인 하자마자 이용자 비밀번호 변경하라는 메뉴가 무조건 뜨고, 새 비밀번호 입력해도 '장기미사용 이체정지 고객은 이체성 거래가 불가능' 하다며 그 어떤 진행도 안됩니다. 아니 '비번 번경' 하라면서 이게 왜 '이체성 거래' 야? 내가 국어를 잘못 이해하고 있나?"
500,501,20200825,2020,08,25,1,루도비카,기존앱보다 복잡하군요 다운받는순간부터 엄청 스트레스 아예 하나 원큐 사용 하지말라는 홍보물같음 로그인방법 오히려 정보노출 하기 딱 좋은 느낌 정보노출 안시키려 복잡하게 만드는것이 한번 뚫리면 왕창 크게 뚫릴수 있음을 아시는지... 그냥 구버전으로 끝까지 활용할 생각임
501,502,20200912,2020,09,12,1,제이미,구버전에서는 체크카드이용내역을 바로확인할수있어서 편했는데...새로운앱은 도대체 카드이용내역은 어디서확인할수있나요... 매입된거말고 아직 미매입인것도 확인이되야해요.. 제가 해외에서 쓰는거라 늦게반영이되는건지 실제계좌잔액이랑 다른것도 구버전은 확인이되는데...신버전은 확인안돼요.. 정말 개선이 필요해보여요..아님 불편해서 하나은행 거래를 중단해야할거같네요..
502,503,20211220,2021,12,20,3,혠,업데이트 전부터는 앱을 잘 사용했는데 업데이트 이후부터 앱을 들어가면 V3 mobile plus가 작동되지 않아 보안이 불안하여 사용을 못하고 있습니다. 앱 삭제 후 실행하여도 해결이 되지 않아서 계속 사용을 못하고 있습니다. 어떻게 해야할까요?ㅠㅠ
503,504,20220303,2022,03,03,1,wer q,기존에 스크롤 되던걸 업뎃하면서 안돼게 만들었으면 수정해서 재업뎃하게 해야지 먼 영어를 잔뜩써놨네 그거 할수 있는 사람 몇이나 될까 몇번하다 포기함 개발자 수준에서 설명하지 말고 원레 대로 돌려놓으세요 몇번을 앱삭제후 재설치 해도 안돼는 건 마찬가지 개발자님 이 앱 수백만이 다운 받아서 사용하는데 이전에 되던 기능이 안돼면 내 핸폰이 이상한가 앱삭제후 다시 깔기 핸드폰 껏다키기 등을 하며 스트레스 무지하게 받는 건 아시나요 웹뷰가 아짜규 저쩌구 버전표시되는 건 2.25뿐인데 설정 앱 가봐도 개발자가 설명한거는 찾을 수 없고 업뎃 좀 충분히 테스트 하고 하쇼 욕이 한바가지 나오지만 답변은 빨리 다시다네 제폰 g6입니다 설정 가면 일반 /앱.앱알림 이렇게 되고 검색 자체 가 없다오 또는 설정가서 상단에 webview 검색하면 droid-x 3.0만 검색 되다오 개발자는 설명은 최신폰 기준인가 본다 그냥 앱 지우고 새로깔테니 구버전 올려주소
504,505,20220429,2022,04,29,5,양동욱,한글로 가져오기 보내기로 되어있어서 편리하게 이용하고 있습니다
505,506,20200928,2020,09,28,1,J Lee,그나마 지난번 앱이 직관적으로 훨씬 쓰기 편합니다. 새 버전 깔았다가 쓰기 너무 불편해 보여 바로 지웠어요. 구버전이 폰에 그대로 남아 있어 다행이네요.
506,507,20210110,2021,01,10,1,이재희,"얼굴인증, 소액 OTP없이 간편이체, 간편비밀번호 다 등록해놓고 잘 쓰고있었는데 갑자기 다 초기화 되어있고 아무것도 등록이 안되어있다고 합니다. 급하게 이체할 일 있는데 이게 대체 뭔가요? 업데이트 할꺼면 제대로 하시던가요? 정보 다 초기화시켜놓고 참나 기가막히네요"
507,508,20211228,2021,12,28,1,허미정,처음 남겨 봅니다. 앞전에 업데이트 하니 하나머니사다리 계속 1머니는 꼭 나오 더군요! 크게 변화되는것도 없는데 계속 업데이트를 하라고 하니 오히려 더 불편하네요. 확실하게 달라지는 것이 있을 때 하도록 합시다. 데이터 사용료만 보태주네요.
508,509,20201220,2020,12,20,1,오진선,구버전이 더 보기가편해요 자영업이라서 이체를 많이 하는편인데 구버전은 최근 이체 내역이 아래에 정렬되어서 편한데 신버전은 클릭을 여러번 하게 만드네요 비밀번호 간편번호도 두번이나 누르게하고 너무 불편해서 구버전 삭제했다가 다시 깔았어요
509,510,20200821,2020,08,21,1,이인희,과거 앱보다 못합니다 심플이체 빠른이체 기능도 없어지고 자주쓰는계좌에서 입금액 입력해도 수정안되고 검색에서 이체 조회후 이체바로가기 해도 멈취버리고 이런 상태로 오픈해도 되나요? 결국 과거앱 다시 깔았습니다
510,511,20200824,2020,08,24,4,DongJin Kang,전반적으로 저번버전 보다는 편리해진것 같습니다. 그런데 앱의속도가 항상 다른은행에 비해서 느린감이 있습니다. 이점만 보완 된다면 만족할 것 같습니다.
511,512,20200915,2020,09,15,2,shiny,비번설정해 뒀는데 자꾸 비번설정안됐다고 하라하고 다시 번호누름 또되고 터치화면이 세개의 점이 위아래로 출렁이다 실행되는데 마치 화면도 고정되지않고 출렁이게 느껴져 정말 별로입니다 구 하나 어풀이 훨 낳습니다
512,513,20200824,2020,08,24,1,huckleberrynew,"얼굴인증 너무 불편함. 안 쓰고 싶은데 삭제도 안 되고. 사용자가 필요 시 추가, 제거하여 선택 사용할 수 있게 해주세요. 잘 되지도 않는 얼굴인증을 디폴트로 넣어놔서 짜증만나네요. 이체시 인증방법을 바꾸려면 간편비밀번호로 재접속해야한다니 기가찹니다."
513,514,20200925,2020,09,25,5,Byeongkyu Kang,"새로운 앱으로 변경되어 새로 설치 했어요, 모든 계좌를 한번에 볼 수 있도록 배열해 본인의 금융 정보를 쉽고 빠르게 확인 할 수 있네요, 앱이 변경되어 불만을 얘기할 수 있지만 개선되어 나가는 시스템이 보기 좋네요, 앞으로도 안전하고 정확한 하나은행 부탁 드립니다."
