,id,date,dateYear,dateMonth,dateDay,rating,userName,content
103,104,20200925,2020,09,25,3,Audre y,"어제부터 앱 로그인이 안되더니 현재까지 같은 현상입니다. 안내 팝업은 내용도 안뜨니 알 수도 없고, 기업용 뱅킹으로 처리할 은행업무를 못해 너무 불편합니다."
104,105,20200512,2020,05,12,1,anna choi,비대면계좌개설 안되요 면허증 인식은제대로됐는데 빈칸채우면 계속오류떠요 결국 은행가서해야하는거자나ㅜㅜ 수정좀합시다쫌
105,106,20190503,2019,05,03,5,Google 사용자,왜 꺼졌다 켜지죠 ? 계속 인증서 로그인화면에서 처음화면으로 갔다가다시 로그인 하면 또다시 처음 화면으로 가는데 뭐죠 ?
106,107,20201110,2020,11,10,1,노현준,간편송금 신청 후 사용하려고 하면 간편송금 신창하라고 또 나오고 다시 신청해서 사용하려 하려하면 또 신청하라고 나오는데... 정말 신경질남
107,108,20220119,2022,01,19,1,m kim,아!욕나와 로그인이 뭐이리 힘들어 미친 쓰레기 어플! 요즘세상에 결제도 쉬운데 모이렇게 힘들게 해놧냐 돈도 못보내고 열받아 죽것네!! 쉽게 좀 다시 만들어라 개인기업용은 잘 되던데
108,109,20210214,2021,02,14,1,손희준,시스템오류가 계속나고 진짜스트레스받네요 이어플
109,110,20200629,2020,06,29,1,클아,실행도 잘 안되고 인터페이스 이상하고
110,111,20220215,2022,02,15,1,김영수,이체 하려는데 창이 안 넘어가요 빠른 해결 부탁드려요
111,112,20220213,2022,02,13,1,문래동경비,폴드1업뎃후 안되네요 폰 업데이트에도문제가잇는건지
112,113,20210730,2021,07,30,1,Cute baby Yull,계속 버퍼링만되고 오류만 뜨네요ㅠㅠ
113,114,20201109,2020,11,09,1,김주용,별하나도 아까움 로그인 로그아웃되묜 전자서명 오류 계속뜸 완전종후 다시 켜야함 귀차니즘 앱
114,115,20210813,2021,08,13,1,남현욱,최악에 속도도 느리고 편리성없고.
115,116,20180930,2018,09,30,1,Google 사용자,다른화면에서 결재정보 확인하려하면 홈화면으로 바뀜. 계좌넣었던 정보 다날림. 반드시 정보적어놓고 이체해야함. 저가아웃소싱으로 프로그램 개판 만들어놓음.
116,117,20210506,2021,05,06,1,Eun Cho,간편송금서비스 인증한지 하루밖에 안됬는데 왜이렇게 자꾸 가입하래요?? 정말 짜증나죽겠네요
117,118,20200925,2020,09,25,1,광명귀염이,왜 엡이 실행이 안되나요? 정상적인 엡이 아니라고 계속 튕기는데
118,119,20200422,2020,04,22,1,Google 사용자,도대체 사진을 몇번이나 찍어야되는지 계좌개설 비대면으로 되기는 합니까? 앱을 왜이렇게 만들었나 모르겠네요
119,120,20200423,2020,04,23,1,Google 사용자,신분증 촬영을 백번 넘게 하는데 당최 인식이 안되네요
120,121,20200325,2020,03,25,1,Google 사용자,신규 개설시 신분증촬영 화면에서 처음화면으로 계속 돌아옵니다. 어서 고쳐주세요 종일하다가 포기 ㅠㅜ
121,122,20200128,2020,01,28,1,Google 사용자,입출금 알림을 2분 지연시켜서 알려주는 세계 최초의 어플! 내가 왜 이 은행을 선택했을까 반성하게 만들어주는 어플! 곧 떠날게요 안녕~!
122,123,20201123,2020,11,23,1,연경,신분증 촬영 기능 오류. 카메라 활성화 안 됨. 갤s4 안드로이드4.4.2버전
123,124,20190408,2019,04,08,5,Google 사용자,화면이 큼지막해서 보기 편하네요
124,125,20201030,2020,10,30,3,초이LED,오류가 많아요.아이디입력시 뒷자리일부가 표시가 안돼요
125,126,20190722,2019,07,22,5,Google 사용자,푸시알림 토큰을 가져오지 못했다면서 어플이 안켜져요 당장 계좌이체해야하는데 어떡해야하나요
126,127,20200427,2020,04,27,1,Google 사용자,별 하나도 아까워도 뱅킹이체 로딩이 엄청 길어요
127,128,20210323,2021,03,23,1,Eplex Eplex,공인인증서 비번 2번입력하는거랑 OTP없이 송금 좀 간편히 되도록 좀 개선하길 오늘은 왜 자꾸 실행이 안되는지 또 다시깔고 있음
128,129,20211022,2021,10,22,1,SM SM,설치가 이렇게 안되네요 버퍼링만 계속...
129,130,20200617,2020,06,17,1,임현순,아니 접속을했는데 켜지지도않게되있는데 첫화면에서 닫는게 말이안되네여... 쓰라고만든어플맞나요?...
130,131,20210824,2021,08,24,1,하노카,계속 버퍼링 걸리고 앱이 실행이 안됩니다. 삭제하고 다시 깔아도 동일 증상이네요 벌써 몇주째인지 모르겠습니다. 은행을 갈아타야 하나요
131,132,20200925,2020,09,25,1,뭉뭉,돈보내야하는데 왜 네트워크뮈라하는데 빨리좀고쳐봐요 다시 깔았는데도 안되니깐
132,133,20220216,2022,02,16,1,진호,업데이트후 앱이그냥튕겨나와요 빠른오류 수정부탁드립니다
133,134,20201228,2020,12,28,1,W L,간편송금 1일한도 고정되어 있어 불편. 개인 고객 아닌 사업장 고객은 무조건 otp 필요함.
134,135,20210604,2021,06,04,1,이지원,로그인을 두번씩해야되서 불편함
135,136,20200410,2020,04,10,2,Google 사용자,로그인했는데 갑자기 로그아웃 돼 버리네요 최근들어서 매번 그러네요
136,137,20220427,2022,04,27,1,Seung Won Lee,진짜 은행어플 중 제일 최악이다.
137,138,20210908,2021,09,08,1,김성진,"인증서가 있는데 없다고 인증서발행에서 5단계까지 가고, 6단계 못 넘어감. 사용하지 말라는것인지?"
138,139,20200422,2020,04,22,1,Google 사용자,몇번 하다가 갑자기 오티피 오류->은행방문 고쳐줌->몇번하다보니 지금 또 오류. 어쩌라는겁니까?
139,140,20200515,2020,05,15,1,Yong Cheol Park,신문증 인식도 못하는걸 왜 만든건지..
140,141,20210527,2021,05,27,1,홍상우,인터넷뱅킹 가입하려고 문자인증하는데 문자가 안오는건 무슨경우인가요 사람 놀리는건가요
141,142,20210414,2021,04,14,1,최민영,도대체 안됩니다 인증서는 대체 뭐고 다음으로 넘어가질 않아요
142,143,20200428,2020,04,28,1,Google 사용자,당신들이 사진촬영시 빛없이 촬영해보소~~ 손떨림보정 및 수십차례 확인해봐도 절대안됨 자꾸 빛반사없이 촬영하라는데ㅋ암실에서 찍어야겠네 짜증나서 포기한다 개발자들 리뷰보고 일즘해라 돈만받아먹지말고
143,144,20220124,2022,01,24,1,장지복,금융인증서을 몇번을 구입했는지모르겠네요..로그인도 안되고..혈압올라서 폰 던질뻔했습니다.
144,145,20220317,2022,03,17,4,양영남,법인체크카드 사용시 알람이 오도록 설정 할 수 없나요?
145,146,20211212,2021,12,12,1,이개똥,들어가서 조회좀 해볼려니까 뭐 이리 복잡합니까? 그냥 이걸로 스트레스 받느니 직접 은행가는게 빠르겟네요
146,147,20200925,2020,09,25,1,JY_bin,진짜 답답하다.. 로그인하는데 앱이 수십번 아웃되고 욕나온다
147,148,20190811,2019,08,11,1,Google 사용자,구버전 지웠는데 어디서 다운받고 단순뱅킹 해지해야됨
148,149,20210401,2021,04,01,2,박상우,로그인오류반복됨 한번에 로그인 안 되고 매번 2번째 로그인됨
149,150,20190319,2019,03,19,5,Google 사용자,사용자 편의에 높은 점수를 줍니다
150,151,20200925,2020,09,25,1,마이올,어플 에러가 심합니다 고객센터 전화해보니 15분이 지나도 연결이 안 되고.. 어이가 없네요 아래 담당자 내선번호로 연결해도 자동응답만 주구장창 기업은행도 이제 다 됐나 봅니다 기업체라 주거래은행 바꾸는 거 쉽지 않은데 이번에는 알아봐야겠습니다 좋은 은행으로 생각했는데 아쉽네요 근래 기업고객 서비스가 더욱 형편없어집니다
151,152,20200410,2020,04,10,1,Google 사용자,표준산업분류에 왜 항목이 없나요..뭘 선택을 할 항목도 안 뜨는데 어떻게 개설을 하라는거죠?..
152,153,20210323,2021,03,23,1,정세호,오류가 진짜 어지간히 많네요 은행어플을 이렇게 못만들기도 쉽지않을텐데 에휴
153,154,20201118,2020,11,18,1,TTO SOG,네트워크 안된다고난리네...왜그러죠 잘쓰다가...
154,155,20201113,2020,11,13,1,JUWON KIM,기업은행 곧 문닫나요??? 어디로 병합되나봐요??? 어플이 왜 이모양이며 불만과 개선요청의 목소리가 왜이리 많은가요??? 3대까지 먹고살만큼 많이 벌어놨나봐요???
155,156,20210323,2021,03,23,1,주객기,안열리는데요 송금해야되는데 은행가서해야되나요 겁나 멀리있는데 이건 쓰라고 만든건가요 제발빨리 복구해줘요...
156,157,20200213,2020,02,13,1,Google 사용자,다른 금융어플. 부산은행 모바일 뱅킹에비해 너무 불편하고 인증절차도 쓸데없이 많고 까다롭다. 어플자체에서 끊김과 렉이 많다.
157,158,20190228,2019,02,28,1,Google 사용자,아.. 거래처에 입금해야하는데 로그인이 안되면 어쩌란 말입니까 진짜!!!
158,159,20210208,2021,02,08,1,박준우,웬만하면 안남기는데 정말 최악..OTP팔아먹은 직원 고발하고 싶은 심정
159,160,20191103,2019,11,03,1,Google 사용자,어휴..기존에 사용하던 인터넷뱅킹(pc포함)모두 해지후..기업용app으로 가입하면 사용가능..
160,161,20210602,2021,06,02,1,윤석현,제발 기업용도 개인용처럼 업데이트좀 제발해주세요 개인용은 잘만들어놓고 기업용은 이렇게 오류도있고 불편하나요 지문인식 같은것도없고 제발요
161,162,20200212,2020,02,12,1,Google 사용자,이렇게 안불안한 금융어플은 처음입니다 로그아웃 계속 자동으로 되고 로그인도 잘안되고 이제 어플 실행도 잘안되네요 어플 좀 잘좀 만드세요 카카오뱅크 사업자 통장 나오면 바로 바꿉니다 이러니까 일반은행이 카카오뱅크에 밀리는겁니다
162,163,20181128,2018,11,28,1,Google 사용자,타은행 인터넷뱅킹보다 너무 퀄리티가 떨어지고 다운도 잘되고 너무 불편함
163,164,20190711,2019,07,11,1,Google 사용자,대표계좌번호에 대한 출금지정 서비스가 되게 해주세요. 항상 선택해야 하는 이유가 있나요?
164,165,20201201,2020,12,01,1,사진,이거 진짜 구림 핵똥구려 쓰다가 매번 놀라요 이렇게 불편한ㄱㅓㅅ두있구나~
165,166,20190419,2019,04,19,4,Google 사용자,국세계좌 납부가 안됩니다. 계좌번호19자리 쓴 후 다음 화면으로 안넘어 갑니다. 앱 삭제 후 재설치 해도 안됩니다. 조치 부탁드립니다.
166,167,20200222,2020,02,22,1,Google 사용자,앱이 계속 안 열려서 입금내역을 확인할 수가 없어요. 최악
167,168,20190807,2019,08,07,1,Google 사용자,"단순거래고객이라 로긴안되는 오류, 가입진행했더니 삭제한 기존아이원뱅크서 뭘해지하고오라는데 어쩌라는거져? 서비스중단된 앱에서 뭘 어떡하라고? 내 시간 수고 보상해줘. 기업은행거래하지말라는거?"
168,169,20190603,2019,06,03,1,Google 사용자,"기업은행기업뱅킹앱 설치해 기업공인인증서로 로그인 하려는데 단순거래 인터넷뱅킹에 가입되어있어서 해당로그인 하라면서 오류 뜨는데,기업뱅킹앱에서 기업공인인증서 로 로그인 하는 방법 밖에 안만들어 놓고 기업공인인증서 로그인 안되면 어쩌래는겨? 구버전처럼 하나의 앱에서 개인과 기업 둘다 되든지, 각자 로그인 잘되게 하든지 얼릉 수정 바랍니다."
169,170,20200925,2020,09,25,1,조은정,왜자꾸오류나는지..사업자통장인데 진짜 미쳐버리겠네. 어찌좀해봐요!!!!!
170,171,20201208,2020,12,08,1,Jung-Hyun Cho,왜자꾸 로그인 반복하게 하는겁니까? 한두번도 아니고..개발자들 알고있을거 아닙니까?
171,172,20200319,2020,03,19,1,Google 사용자,개인사업자 최초계좌 개설 시 신분증 촬영으로 넘어가지 않고 계속 첫화면으로 복귀하네요.
172,173,20200924,2020,09,24,1,김태우,이거 계속 정상적인 앱이 아닙니다 떠요
173,174,20211008,2021,10,08,5,고단비,첨엔 힘들었는데 손에 익으니 최고에요
174,175,20191210,2019,12,10,1,Google 사용자,가까워서 기업은행거래하고 있는데. 불만이 너무많아 정말 짜증나네요
175,176,20220130,2022,01,30,1,이재명,버그때문에 사용이 안됩니다
176,177,20190815,2019,08,15,1,Google 사용자,기존 사업자 가입을 할려고하는데 안되네요 신분증촬영에서 안넘어갑니다 입금할데도많은데 이유가뭐죠 답답해 죽겠네요
177,178,20190203,2019,02,03,1,Google 사용자,기업은행 i-ONE뱅크(기업용) 이라고 어플이름 바꾸세요. 이런것까지 알려줘야 됩니까? 명확하게 표기해야 착오가 없죠. 진짜 이걸로 안되서 헛고생시간 생각하면 개발자 귀빵맹이 날리고 싶네요. 스마트폰 쓰고 리뷰 처음남깁니다. 낚시하는것도 아니고 참...
178,179,20200118,2020,01,18,2,Google 사용자,왜 지문과 재접속할때마다 공인인증서를 켜야합니까
179,180,20200925,2020,09,25,1,effect pygmalion,모듈초기화 실패계속 뜸
180,181,20210513,2021,05,13,3,이을영,앱 기능에 대출금 중도 상환을 할수 있는 매뉴가 없네요? 만들어 주세요
181,182,20220119,2022,01,19,2,이여진,공동인증서 안깔리시는 분들 앱을 원스토어에서 업데이트이전 버젼으로 다시 받아보세요 그럼되요. 고객센터 상담원이랑 통화3번하고 원인알아냄ㅡㅡ
182,183,20201022,2020,10,22,1,Dicaprio Rosy,개구림 로그인2번씩 해야 접속됨 로그인도 공인인증서만됨 역시 공기업이야 시중은행과 다른 저퀄리티 일을 설렁설렁
183,184,20200924,2020,09,24,1,hayun jeon,최악 최악중의 최악이다. 그냥 이유없이 꺼지는 건 기본이고 솔직히 법인통장아니였으면 어떻게 해서든 무조건 은행 바꿨다.. 하 최악
184,185,20200925,2020,09,25,1,엔지그리,모듈 초기화 실패 오류 고쳐주세요
185,186,20201118,2020,11,18,1,후하천수,무분별한 업데이트는 피곤하다
186,187,20210108,2021,01,08,1,남성남성남자,다른 은행들 처럼 간편 로그인 방식 좀 만들어 주세요~ 날마다 로그인 할때 인증서 비번 누르기가 힘들어요~ ㅠ
187,188,20200807,2020,08,07,2,sengsengaqua,정말 불편합니다 ᆢ 에러 많고ᆢ
188,189,20190626,2019,06,26,5,Google 사용자,편리하고 좋아요
189,190,20200925,2020,09,25,1,떼떼아범,정상적인 앱이 아니라는데...이체를 못하고 있습니다.
190,191,20210805,2021,08,05,1,류창규,이체하려하니 로그인 은커녕 버퍼링만... 결국 은행을 갓어요
191,192,20190620,2019,06,20,1,Google 사용자,그냥 구IBK기업행 어플이 쓰기 좋다 변경한거 개판이네 잘 쓰고 있었는데 뭐냐고 기업은행 디자인 개판으로 만드네
192,193,20210603,2021,06,03,1,김성호,최악이네요. 로그인 오류 몇번째인지
193,194,20210323,2021,03,23,1,K YU,두번씩 로그인 아직도 안고치네.. 일은 하시는걸까
194,195,20181127,2018,11,27,1,Google 사용자,아 다른분들 무슨말인지 했는데 표기좀 똑바로 하세요 한시간 삽질했네
195,196,20210114,2021,01,14,1,MinQ Cheon,쓰레기 앱 쓰기 싫어서 다른 은행으로 갈아탈지 고민중 10번째 로그인 시도하다 짜증나서 리뷰 쓰러옴 로그인이 되야 이용을 하던가 말던가 하지
196,197,20220215,2022,02,15,1,나로디자인,안드로드 업데이트후 계속튕김 조치요망
197,198,20210706,2021,07,06,3,알아리오,내계좌환전에서 다시 뒤로가기는 안먹혀요
198,199,20210307,2021,03,07,1,김준혁,진짜ㅜ로그인 2번 뱅킹앱중 가장최악
199,200,20200810,2020,08,10,1,김하영,어플이 2시간째안열립니다 사업자계좌로못쓰겠네요 성질나네진짜
200,201,20200602,2020,06,02,1,박샛별,비대면 계좌 개설 성공한 사람이 있긴함? 신분증 인식이 정말 그지같네 욕이 절로나옴. 이럴꺼면 왜만들었는지 모르겠음. 리뷰보니까 나만 그런것도 아니네.
201,202,20200916,2020,09,16,1,유현준,"표준산업분류가 안뜨네요,,"
202,203,20200512,2020,05,12,2,김정선,업데이트 너무너무 안 되네요
203,204,20210217,2021,02,17,1,호르몬케이,뭐 되는게 없냐 데모수준도 아니고 뭐진행이 안되는데?
204,205,20220623,2022,06,23,1,따상,"불편, 잘 안됩니다ㅜㅜ"
205,206,20200828,2020,08,28,1,Youngin Kim,가장 사용하기 어려운 은행 어플 다시는 이 은행 이용 안한다
206,207,20210806,2021,08,06,1,이태원,무슨 지방 저축은행도 아니고 로딩에서 몇시간째 넘어가지를 않고 리뷰보면 죄다 같은 증상이네 진짜 부끄러운줄 알아야지 외부 출장중에 급하게 거래처 입금도 못하고 진짜 성질나서원 요즘 같은 시대에 폰으로 뱅킹도 못하는 은행 이게 말이됩니까?
207,208,20210809,2021,08,09,1,이광원,어플 실행 불가. 회사 급한데 한두시간도 아니고 이건 뭡니까 쓰레기 평가 받고 싶으세요?
208,209,20210425,2021,04,25,1,유johnny,한번에 로긴되는경우가 없네요!
209,210,20211222,2021,12,22,1,이규환,거래내역조회시 글씨가 이중으로 겹쳐서 보이는데 해결해주세요
210,211,20220301,2022,03,01,1,정상문,대체 언제 해결될런지 공동인증서
211,212,20220317,2022,03,17,1,개미가 미래당,공동인증서 있는데 못찾음
212,213,20210127,2021,01,27,1,yh kim,명색이 기업용 간편송금이 300 만원이라니? 최소 2천은 돼야하지않을까요?
213,214,20220217,2022,02,17,1,인생NO빠꾸,폴드1 업데이트 이후 안됨
214,215,20190315,2019,03,15,2,Google 사용자,뭔 오류가 이렇게 심해요?? 동네 구멍가게 어플도 이러지는 않을듯 하네요ㅡㅡ
215,216,20181120,2018,11,20,1,Google 사용자,부팅속도가 386PC보다 느림 세상에서 젤 느린 앱
216,217,20210407,2021,04,07,2,Alex Kim,꼭 두번씩 로그인해야함
217,218,20201018,2020,10,18,1,윤용훈,아세상에서 젤 불 편하고 진심 욕만나오네요 내통장으로 이체하나 하는것도 쓰는게 왜이리 많은지 화가 치밉니다
218,219,20200615,2020,06,15,1,승경민,"최악의 금융앱이네요, 개선 좀 하세요..."
219,220,20200609,2020,06,09,1,요롱이,신분증 인식 안됩니다. 개선좀하세요. 1시간째 딱50번시도했는데 그냥안됨. 폐지하시던가 개선하시던가 괜시리 시간낭비 감정낭비 은행어플이 이리 허접합니까
220,221,20211005,2021,10,05,1,박채요니,30분간 앱 버퍼링 인내심 한계
221,222,20201219,2020,12,19,1,박선영,로그인 불변함개선요청 로그인 반복 오류 개선 요청 아 기업용 뱅크 다른은행으로 갈아타고 싶다.
222,223,20210327,2021,03,27,1,홍주원,장난해! 열리지도 않고!!
223,224,20191121,2019,11,21,1,Google 사용자,안드로이드고 설치가 안되요 앱 설치한다고 뱅글뱅글 돌기만하지 설치가 안됩니다
224,225,20200713,2020,07,13,1,루떠라이,도대체 지금 몇십번째 시도하는건지도 모르겠다 욕 밖에 안나오고 도대체 왜 표준산업분류를 눌러도 아무것도 뜨지않는지...뭘 선택하라건지; 돈받고 일하면 제대로 만들던가 아니면 리뷰 좀 읽고 수정이나 제대로 고치던가 .. 놀고먹고 자빠졌냐?
225,226,20200925,2020,09,25,1,윤종수,아니 로그인 자체가 안되는건 뭔가요 ?
226,227,20190509,2019,05,09,1,Google 사용자,로긴했는데 제 계좌가 안보여요 왜그런가요? 계좌가 있어야 뱅킹 로긴 되는건데 ㅋ
227,228,20200410,2020,04,10,1,Google 사용자,핸드폰인증번호가안와요 몇번을해도안오네요. ㅠ ㅠ
228,229,20200728,2020,07,28,1,seorak lineage,"최악의 은행 어플, 광고하는 거 반만 써라."
229,230,20200829,2020,08,29,1,HYO-JI YOO,EDD 인증하래놓고 신분증 인식 너무 못함. 50번찍다 안돼서 은행감
230,231,20211203,2021,12,03,1,Heesu Kim,타은행 공인인증서가 안되면 어떻게 이용하라는거죠???? 개발..실화인가..
231,232,20200925,2020,09,25,1,김정현,모듈초기화실패가 자꾸떠요
232,233,20200407,2020,04,07,1,Google 사용자,설치됐다며? 어디에 설치가 됐단건지..참나
233,234,20200924,2020,09,24,1,"J.M, LY",왜 갑자기 오류인가요
234,235,20210912,2021,09,12,1,인간적인 알투비트,아니 다운만 받아지고 설치가 안되는데?
235,236,20181122,2018,11,22,1,Google 사용자,"기업용인지 개인용인지 똑바로 구분지어서 만드세요 ㅡㅡ 검색하면 맨 윗줄에 이 어플뜨길래 공인인증서 복사하기 눌렀는데 자꾸 안돼 자세히보니까 기업용이라고,, 가뜩이나 은행 이름도 기업은행이면서 왜 사람헷갈리게 그러세요 개발자님아?;;"
236,237,20190520,2019,05,20,3,Google 사용자,입출금 푸쉬가 안오는데 왜 그럴까요??
237,238,20210810,2021,08,10,1,하늘섬,이거 만든사람 짤라라 진짜 뭐 맨날 접속이 안되 어쩌다가는 접속되고 또 안되고 진짜 진지하게 말하는데 이거 만든 업체 바꿔라 진짜
238,239,20200925,2020,09,25,1,흑곰,접속이 되야 뭘하지
239,240,20211110,2021,11,10,1,도전해,버퍼링 심함. 다른 은행도 마찬가지.....
240,241,20210120,2021,01,20,5,주동훈,사용후기 매우좋다
241,242,20200924,2020,09,24,1,김이환,로그인자체가 안돼요
242,243,20200407,2020,04,07,4,Google 사용자,i-one뱅크 왜 설치가 안되나요?
243,244,20200712,2020,07,12,2,배준성,이체가 타은행에 비해 불편합니다
244,245,20191027,2019,10,27,1,Google 사용자,인증서 비밀번호가 에러..이런
245,246,20190319,2019,03,19,5,Google 사용자,가장 트랜드한 앱 최고
246,247,20200921,2020,09,21,1,유현수,사진인식 안됩니다
247,248,20200429,2020,04,29,1,김순옥,도대체 카드등록은 어떻게해야하는건지?
248,249,20200511,2020,05,11,1,변두리,신분증 확인이 안됨
249,250,20210108,2021,01,08,1,C.H Kim,간편 송금시 공인인증서 비밀번호 입력 화면에서 숫자 입력 안됩니다. 제발 수정해주세요.
250,251,20211226,2021,12,26,1,구루.구루,쓰레기어플 기업 통장으로 기업은행 선택한걸 제일 후회함 어플 켜지지도않음 이렇게 만들거면 만들지를 마세요 다른은행 똥x멍도 못따라가는 기업은행
251,252,20210702,2021,07,02,5,권일섭,사용자가편리하도록해줌
252,253,20190625,2019,06,25,1,Google 사용자,홈텍스인증하기부터 먹통 첨부터다시해야하나요?ㅠ아..
253,254,20211212,2021,12,12,2,돌탱,주거래은행이 이사가서 가게에서 제일 가까운 기업은행 계좌 트고 앱을 써보니 한마디로 그냥 불편함~ 매우 불편함!!! 거래처에 이체 할때 그냥 개인계좌 타은행 어플쓰고 있음 ㅋㅋ
254,255,20210416,2021,04,16,1,김흥근,바이오 인증 추가 안되나요?
255,256,20200416,2020,04,16,1,Google 사용자,앱이 다운로드가 안되요 ㅠㅠ
256,257,20200925,2020,09,25,1,Jinilus Real,앱관리상태 엉망
257,258,20190601,2019,06,01,3,Google 사용자,일단범용공인인증
258,259,20220208,2022,02,08,5,정진흥,입출금관리가한눈에들어옴
259,260,20200817,2020,08,17,1,이주연,애미 터진 안된다고
260,261,20210214,2021,02,14,1,엄도현,지금왜안돼나요 로그인자체가오류
261,262,20201014,2020,10,14,1,jaebok yu,개인사업자 최초계좌계설에서 5.정보확인에서 표준산업분류가 비활성시는 홈택스와 은행어플상 영업코드 문제로 갱신시 시간이오래걸린다고합니다. 은행방문해서 계좌개설해야한다고합니다.혹시 참고하세요.
262,263,20210621,2021,06,21,5,정효정,좋아요감사해요
263,264,20200516,2020,05,16,2,김나은,신분증 촬영 성공하신분 리뷰좀 남겨서 방법 좀 공유해주세요ㅡㅡ그냥 바쁘던지말던지 그건 고객님 니 사정이니까 은행오세요 라고 말을하지...사람 열받게하는방법도 참 가지가지네..
264,265,20210202,2021,02,02,1,AutoSell,개인 기업용 나눠져있능거자체가 그냥 안쓰고싶어서 기업은행 안씁니다.
265,266,20211209,2021,12,09,1,강태윤,인증서발급이안돼요
266,267,20210509,2021,05,09,1,유수현,어플때문에 주거래은행 변경합니다 안녕히계세요
267,268,20200925,2020,09,25,1,이노무숙희 Husky,왜안돼? 자꾸팅기고? 이딴거왜만들어?
268,269,20200408,2020,04,08,1,Google 사용자,다운로드조차 안 됨
269,270,20200426,2020,04,26,1,Google 사용자,문제 : 결제와 결재의 차이는?
270,271,20210302,2021,03,02,1,킴현군,설치자체가 안되는앱 국내 은행중 원탑인듯 하네요
271,272,20190618,2019,06,18,1,Google 사용자,개인사업자 통장은 안되자나요 새로나오는거랑 둘다안되면 어쪄라는겁니까?
272,273,20190228,2019,02,28,1,Google 사용자,ㅡㅡ 로그인자체가안되네 네트웍오류자꾸나고 앱점검을안하시나봄
273,274,20210915,2021,09,15,5,김원호,금전의 자산 신종 지식 안전 관리 삼총사 성공 스토리 입니다
274,275,20220215,2022,02,15,1,조민혁,폴드1 나도안됨 사업하는사람이 은행어플이 얼마나 중요한건데 요즘세상에 이딴 오류를 하나 못잡냐
