,id,date,dateYear,dateMonth,dateDay,rating,userName,content
0,1,20220808,2022,08,08,1,John Kim,어중이 떠중이로 개발을 해놔서 ux가 쓰레기네요. 카드 신청하려는데 1단계 2단계 3단계... 뭐만하면 다시 처음부터... 목숨하나로 게임하는 기분이에요. 그리고 결정적으로 마지막 단계에서 카드비밀번호 눌러도 아무것도 안떠서 결국 못했네요. 은행가도 고객센터 문의해도 아무 방법을 못찾고. 노트20에서만 나오는 현상인지 뭔지. 제대로 테스트 한 거 맞나요
1,2,20220727,2022,07,27,1,Noname _,다른은행어플은 사용안해보고 만드는듯 모든 불편한 요소를 한군데 모아둔 앱. 어떻게 업데이트할수록 편의성이 줄어드는지ㅋㅋㅋ 지문 로그인도 좀 넣어주라. 그리고 OTP 만 찍으면되지 매번 이체마다 비번이랑 로그인에 사용했던 공인인증서 비번을 찍어줘야하나ㅉㅈ 할말이 많지만 줄인다
2,3,20210130,2021,01,30,1,Three young Chae eun,사실 어쩔수 없이 쓰고는 잇는데 너무 불편합니다 ..개선사항 요청드려요 불편사항 1.. 비밀번호 너무 긴데. 한번에.로그인.안되여ㅠㅠ 가끔. 2번 해야함. 그렇다고.비번 틀린거.아님 2.. 입출금 알림이 없네요. 일일이 긴 비번 치고 들어가서 확인해야함. 개선요청 공인인증서. 컨펌되면. 간편로그인 되게 해주시고요 입출금 알림.부탁드려요 이체는. 돈이 빠지는.일이니 좀 어려워도됩니다
3,4,20200222,2020,02,22,1,Google 사용자,"기업뱅킹 앱 바뀌고 나서 얼마 안가 거짓말 안보태고 쓸때마다 로그인 2번 거쳐야 이용할수 있고요, 1일1오류로 ""전자서명값 오류입니다."" 메시지 뜨면 바로 앱 삭제하고 재설치 합니다. 로그인 다시 해봤자 소용 없거든요. 오류번호 9994 이런 몹쓸 앱은 첨 봅니다. 다시 만들어 주세요 제발"
4,5,20201031,2020,10,31,1,달타냥,정말로 기업은행 반성해야 합니다. 은행 어플 중 가장 불편하고 어플 때문에 은행을 바꿔 버리고 싶은 마음인데 거래처에 계좌 바꾸는 과정이 부담되서 어쩔수 없이 쓰는데 로그인이 한번에 되는 일이 없고 입출금 내역 같은 기본적인 모든 기능이 어떤 은행 보다도 불편하고 사용자 편의는 고려가 하나도 없네여
5,6,20210120,2021,01,20,1,OkJini kang,"사용할때마다 참 불편합니다 어쩔수없이 쓰긴 하는데.. 불편사항을 읽기는 하는지.. 많은 문제점과 개선사항이 올라오는것 같은데, 전혀 해결되거나 개선되지 않음에 실망이 커져 갑니다."
6,7,20201015,2020,10,15,1,no names,참다참다 몇년째 개선이 안되서 쓴다. 시간지나서 로그인튕긴다음에 재로그인하면 꼭 전자서명값오류나 어쩌니하면서 재로그인안되서 앱종료후 다시 로그인하거나 그마저도 로그인해도 다시 로그인하는화면으로 튕김. 태블릿은 가로모드에서 비번입력 보안키패드 다잘려서보임. 지금은 간편송금에서 이용자비번이 소문자숫자인데 영문대문자랑 소문자만 입력하라고 계속뜨고 매일쓰는비번이 안맞다고함. 참고로 나 개발자다 디바이스 설정값 탓하지마라
7,8,20190508,2019,05,08,2,Google 사용자,"간편이체 기능이나 간편로그인, 입출금알림 좀 개선 해주세요. 다른은행 어플 쓰다가 이거쓰니깐 너무 불편해요... 이체를 자주하는데 보안카드 항상 있어야 되고 로그인부터 진짜 너무 불편해요. 이체 한번 하려면 공인인증서 비밀번호를 두번 써야되고 보안카드번호에... 좀 그렇네요^^"
8,9,20210219,2021,02,19,1,Minus Shin,로그인할때 굉장히 높은확율로 공인인증서 비번을 2번 입력해야하는데 개짜증남. 그래서 빠짝 긴장해서 비번 입력하는데 비번 자판이 너무 엣지쪽에 몰려있어서인지 뭔지는 모르겠지만 비번 오류가 빈번히 발생함. 개짜증의 산물. 공인인증서 만든놈도 욕하고싶고 이 앱 만든놈도 욕하고싶음.
9,10,20220731,2022,07,31,1,박종화,"악성앱 있다고 삭제하라 합니다 왜죠? playstore의 protect인증앱인데 악성앱으로 간주되어 이를 삭제 하지 않으면 i-one bank앱을 사용할 수 없네요. 왜 악성앱으로 처리되는지, 이를 해결하려면 어찌해야 하는지, 무시하고 사용할 수 있도록 한다던지.. 보완이 필요해 보입니다."
10,11,20220808,2022,08,08,1,최승진,잘사용중인데 12개월미사용이체정지고객등록 풀려고 재가입-> 핸드폰 통신사 선택시 선택안되고 대출창으로 넘어가요
11,12,20220720,2022,07,20,1,두부,업데이트하고 내역조회가 쓰레기가 됐어요 전에는 한번클릭하면 되는걸 두세번 더 클릭해야 해서 번거롭습니다 담당자가 누군지 몰라도 동선 생각을 하면서 제작을 하세요 이따위로 일하고 월급을 받나
12,13,20220629,2022,06,29,2,M D,아니 인증센터에 세금계산용 인증서를 폰으로 받았는데 PC내보내기를하려고하니 인증센터목록에 세금계산용 인증서가없네요? 처음받자마자는 뜨더니 다음날되서 목록에서 없어지면 갑자기일하다가 이것때문에 하루날려버렸네요 손택스에서는 뜨는데 기업은행어플 인증센터에서는 떳다안떳다하는게 정상인가요?
13,14,20220728,2022,07,28,1,grey,예전에는 로그인 오류가 그렇게 나더니 업뎃하고서는 그게 없어져서 좋은가 했다. 근데 이번엔 계좌조회기능이 헬이 됨 출입금 검색만 하면 앱이 먹통이 되어버림.. 앱 개발자 이러면서 월급은 쳐받고 있는지 요즘 시대에 통장정리 하게 하는 앱
14,15,20220729,2022,07,29,1,삐삡,업뎃 그지같이 해놓으셨네요. 계좌조회 적요에 검색하는거도 위치도 이상하게 바뀌고설정기간 만큼안나오고.. 개발자님 뭐해요? 개노답이네 기업은행 개발자 능지..
15,16,20220307,2022,03,07,1,ZiiZee Zoo,아니 무슨 인증서가 일회용이 됐네요...... 재발급 및 pc내려 받기 해도 한번 사용하고 없어져 지금 아침부터 고객센터 연락하고 컴퓨터에서도 하고 인증서 하나 때문에 하루를 날렸어요 돈도 못 보내고 ㅡㅡ? 빠른 개선 부탁드립니다.
16,17,20210519,2021,05,19,4,H.G Yoo,자동환경설정 버튼 제발 이동/삭제 부탁드릴게요 ㅠ.ㅠ 개인계좌와 사업자 계좌 분리 관리 필요합니다 사업자 어플에서 개인계좌 같이 보고 싶지 않은데요~ 계좌관리 삭제할때는 opt번호 필요하고 실수로 자동환경설정 버튼 누르면 도로아미타불입니다@.@ 이건뭐지 하면서 한 3번 되풀이 했어요 왜 곳곳에 자동환경설정 버튼이 배치되어 있지요?? ㅠ.ㅠ 제발 어플도 그렇고 인터넷 뱅킹에서도 자동환경설정 버튼 없애주세요!!!
17,18,20200407,2020,04,07,1,Google 사용자,신분증등록이 안되네요. 개선이 필요할듯요. 여러번 시도해도 정확히 입력해도 신분증사진등록에서 계속 오류네요. 비대면개설이 이리 안되니...원
18,19,20210216,2021,02,16,1,정만정민,"이 앱은 몇년동안 ㅡ 공인인증서 비번 입력하고 로긴 누르면 앱이 다시 켜지고 그럼 또 다시 인증서 비번 누르고. 업데이트를 해도, 앱 지우고 다시 깔아도 계속 이따위. 개인앱은 안그러는데, 왜 기업용은 매번 이럽니까?"
19,20,20220107,2022,01,07,1,안승찬,공동인증서 무한 가져오기 시전중입니다. Pc에서 인증서 복사해오면 딱한번 쓸수있습니다. 저만 그런줄알았는데 바로 밑에 분도 저랑 똑같네요. 계좌이체할때마다 인증서 복사하던지 제발급받으라는건지... 이런거 빨리고쳐줘야 하는것 아닌가요?
20,21,20211228,2021,12,28,1,자유롭게살자,"2021.12.28일기준 갑자기 인증서가 안나타나서 로그인안되고, 인증서 복사해서 1번만 로그인된후 다시 실행하면 안되는경우. 해결방법. 원스토어에서 어플받아설치. 아이폰은 어떻게 해결하는지는 모름."
21,22,20210310,2021,03,10,3,doojung yoo,기업뱅킹도 단말기 지정 서비스를 만들어주던지 어느 단말기에서 로그인 되고 있는지 알수있게 해주던지 해줘야되는거 아닙니까? 왜 기업은행 기업뱅킹에만 없나요... 고객센터에 물어봐도 개인뱅킹은 되는데 기업뱅킹은 안됀다고하고... 내 계좌에 어느기기에서 접속하는지 아니면 접속권한도 설정할수 없다는게 참... 엉망진창이네요
22,23,20210302,2021,03,02,1,김스팁,로그인을 두번해야 하며 해외 송금도 두세번 시도해야 합니다(해외송금은 웹뱅킹도 마찬가지) 디자인도 올드해서 이제 리뉴얼을 한번 해주실 때가 된 것 같습니다.
23,24,20190905,2019,09,05,1,Google 사용자,그전에 개인뱅킹 기업용 불편함없이 잘 사용했는데 업데이트이후로 기업용 공인인증서로 로그인하면 개인용에 가입되어있으니 그쪽으로 로그인하라는데 .....뭘 어쩌라는건지요 !!!!!기업용뱅킹은 쓸수도 없고 . 왜 불편하게 바꿨나요!!!!!!
24,25,20220208,2022,02,08,1,류장희,"폴드1 업데이트 후 어플에 접속이 안됩니다, 개인 및 알림은전혀 문제없는데, 기업용만 접속이 안되네요.."
25,26,20200107,2020,01,07,1,Google 사용자,장시간 지나면 로그아웃 되는데 거기서 공인인증서 비밀번호 누르면 전자서명 오류라고 로긴도 안되고 어쩌라는 건지... 하루에도 몇십번 메모리 정리후 로긴하는데귀찮아 죽겠음
26,27,20220426,2022,04,26,1,앉으나선하,로그인 안되고 인증센터 안되고 마비네요.
27,28,20220812,2022,08,12,1,yg Yun,입출금 알림 제발 쫌 만들어주세요. 지문로그인좀 만들어주세요. 불편해서 죽겠심다
28,29,20200924,2020,09,24,1,김주성,어플 시작하면 왜 이렇게 로딩이 긴건가요? 원래 로딩길지않앗는대 왜이러죠? 공인인증서 로그인하면 계속 인증서로그인화면으로 돌아가고 왜이러는거죠?
29,30,20220408,2022,04,08,1,taesoon jang,업데이트하라고해서 하는데 업데이트도안되고 삭제하고 다시설치하려는데 삭제했더니 다시설치도안되는데 이게뭡니까
30,31,20220425,2022,04,25,1,난눈누,공인인증서 금융인증서 모든것을 인식하지못하는 오류좀 고치세요 대출연장신청하려고 스마트폰이랑 pc모두 인증서 깔고 온갖 고생을 했는데 결국 오류 해결못하고 그냥 은행창구 갔습니다. 비대면이니 어쩌니 얘기하실꺼면 어플 좀 제발 똑바로 만들고 이슈해결 좀 해주세요 최악이네요 얘랑 소상공인용어플도 함께 고치시구요
31,32,20210528,2021,05,28,1,쿠피,로그인을 2번씩하게만드네요. 한번에 로그인이 안되요. 어플닫았다 다시 열고 로그인해야되는경우가 많아요
32,33,20220722,2022,07,22,1,황금바늘,통장개설시 표준산업분류에 아무것도 안떠서 선택이 불가합니다. ?? 통장 못 만들고 있어요
33,34,20211025,2021,10,25,1,Isher,E뱅킹사용자상태가 정상적이지 않습니다. 라는 팝업문구가 뜨면서 스마트뱅킹 가입이 안됩니다.... 데스크탑으로만 쓰라는건지..
34,35,20211102,2021,11,02,1,박기덕,앱 켜도 계속 로딩 중이고 안들어가집니다. 지우고 다시깔고 해도 계속 그럽니다. 정말 쓰레기앱이네요 ㄷㄷ
35,36,20210223,2021,02,23,1,강진영,아.. 저만 로그인 오류가 많은게 아니었군요. 위안이 되네요. 중요한 계약시 입금해야할때 엄청 당황스러운 경우가 많이 생기죠. 이 어플...
36,37,20220110,2022,01,10,1,백승목,"인증서를 몇번 복사를 하는건지.,. 앱에서도 따로 인증서 발급받고 ,.,.이짓을 몇번 반복하는건지,.,. 오죽하면 화나서 리뷰 남기러왔습니다 어플 상태 좀 점검 하세요"
37,38,20200715,2020,07,15,3,조란영,제대로 로그아웃 했는데 접속할때마다 인증서 비번 누르려는 순간 시간지났다고 연장하냐 묻는글이 계속뜹니다. 하루에도 몇번씩 계좌이체시키는데 몹시 번거롭네요. 수정부탁드립니다
38,39,20200421,2020,04,21,1,Google 사용자,비대면계좌개설하려는데 신분증 정보가 유효하지 않다고 뜨네요. 잘 찍어도 앱과 연동이 안되는거 같은데 미리 계좌개설 할 수가 없는데 뭘 미리 해서 가라는건지 ㅡㅡ 진짜 답답하네요.
39,40,20191108,2019,11,08,1,Google 사용자,이체할 때 공인인증서 로그인까지 다했는데 자꾸 첫화면으로 돌아가는 오류 계속 발생해서 짜증남 리뷰보니 다른 분들도 그런 오류 많이 발생하는 것 같으니 얼른 개선됐으면 좋겠네요
40,41,20190512,2019,05,12,1,Google 사용자,결재올라온 것 반송시킬 때 반송이 안되고 결재가 됩니다. 중대한 버그입니다. 즉시 개선해주세요.
41,42,20190522,2019,05,22,2,Google 사용자,개인인터넷뱅킹에 가입되어 있으므로 해당뱅킹을 통해서 다시 로그인 하시기 바랍니다 이거때문에 로그인 못하고 있어요 어떻게 하죠
42,43,20200925,2020,09,25,1,베르기,진짜 최악이다. 안정성이라곤 1도없고 로그인은 커녕 지멋대로 꺼지고 몇시간동안 안되는경우가 너무 많다
43,44,20210226,2021,02,26,1,황진희,진짜 비밀번호를 왜 매번 두번씩입력해야만 로그인이 되는지 이체수수료는받아가면서 불편사항 개선도없고
44,45,20220120,2022,01,20,1,Gerrard Steven,인증서 계속 날라가시는분들 필독!!!!!!! 플레이스토어가 아닌 원스토어에서 i one bank 기업용을 다운 받으세요. 2019년이 최신버전일겁니다. 그리고나서 인증서 이동하시면 인증서 안날라갑니다. 구글 정책상 어쩌구저쩌구. 랍니다. 결론은....
45,46,20201027,2020,10,27,1,양혜림,로그인 한번에 되는 일이 없음. pc버전이랑 모바일 둘다 심각함. 기업이미지와 바로 연결되는건데.. 왜 개선을 안하는건지.. 불편해서 은행갈아타려고함
46,47,20190509,2019,05,09,1,Google 사용자,업데이트후 서버접속화면에서 계속 멈춰 있습니다. s9 입니다. 빨리 수정해 주셔야할듯...
47,48,20210604,2021,06,04,1,에너자이찬,오류가 너무많아요 이체 한번하고나면 담날은 앱 오류 안들어가져서 지우고 다시 깔아야하고 너무 불편해요
48,49,20210614,2021,06,14,2,뭘보냥,언젠가부터 계속 앱 누르면 버퍼링만 뜨고 접속 자체가 안되는데 도대체 어떻게 해야 하나요. 방법 좀 알려주세요. 재설치만 4번했어요.....
49,50,20200116,2020,01,16,4,Google 사용자,종료하고 나갔는데 다시 접속하면 로그인 연장화면이 뜨네요. 프로그램 종료시 자동 로그아웃 되도록 해주세요.
50,51,20210811,2021,08,11,5,yeon L,로딩만되고 안되시는분들~~ 설정 > 어플리케이션 > 앱삭제 후에 스마트폰 재부팅하시고 다시 앱설치하시면 정상적으로 잘됩니다!!
51,52,20191127,2019,11,27,1,Google 사용자,타행 인증서 등록불가면서 되는척 .. 짜증난다 진심 otp로 등록하면 된다고 하고 막상 진행하면 씨크리트 카드번호 찍으라하고 고객센터는 개인으로 들어가서 그렇게 뜬다는 뻘소리나 해대고.. 혈압만 오른다..쯧
52,53,20200615,2020,06,15,1,JH Fanta,국민 하나 농협 기업뱅킹 하다가 여기 보면 한숨만 나옵니다. 메뉴도 pc뱅킹이랑 비교하면 없는 메뉴도 많고 ㅠㅠㅠ 하 진짜 ...
53,54,20210126,2021,01,26,1,윤영효,이체할때마다 같은 비밀번호를 몇번씩 입력하는지... otp를 안쓰는것도 아니고 너무 과한거같음
54,55,20210804,2021,08,04,1,김성민,계속 버퍼링뜨면서 어플 실행이 안됩니다. 다시 깔아도 그래요. 써야하는데 큰일이에요.
55,56,20200731,2020,07,31,1,MRR MR,업그래이드되면 알려주지도않고 그냥 공인인증로그인만안되고 안되서 보면은 업그래이드해야하고 이게 아주 자주 빈번합니다 대기업이 이래서야
56,57,20211214,2021,12,14,3,김유미,pc에서 공동인증서을 복사해오면 분명히 성공해서 로그인 했는데 앱을 껐다 다시켜면 인증서가 없다고 나와요. 환장하겠네
57,58,20200902,2020,09,02,1,jjung Son,다계좌 이체도 안돼고...한번 이체하려면 인증번호+OTP+인증서번호 3가지나 입력해야하고.. 너무불편해요
58,59,20200927,2020,09,27,1,유호리,"타행공인 인증서 등록도 안되고 인증서 내보내기 가져오기 도돌이표:: 장난이네요 젠장 시간아까워 ~ 뭐이리 복잡하게 만들었는지, 비대면 해보려다 열받아 그냥 갑니다"
59,60,20210512,2021,05,12,2,Ang Neong,pc환경은 자칭 보안프로그램 때문에 충돌나서 못쓰고 모바일은 로그인 버그를 안고치고 총제적난국 타은행대비 양쪽 환경 모두 낙후됐는데 언제 개선하려는지
60,61,20200706,2020,07,06,2,김혜선,갑자기 로그인이 안되요 이동중에 일적으로 이체할일 많은데 너무 불편해요 빨리 개선시켜주세요!!
61,62,20200925,2020,09,25,1,신준호,맨날 오류에 인터넷 연결 안됐다 그러지 급한데 쓸 수가 없습니다. 몇번을 지웠다 다시 깔았는지 원
62,63,20210331,2021,03,31,1,최미란,대체 왜 맨날 로그인을 두번씩 해야만 로그인이되죠? 한번에 된적이 단 한번도 없네요 정말...
63,64,20200925,2020,09,25,1,Ryan Song,"별 하나도 아까운, 쓸 때 마다 짜증나는 앱. 맨날 오류에 버벅대고. 법인계좌 때문에 어쩔 수 없이 사용 중..."
64,65,20210226,2021,02,26,1,Josephine Jo,"로그인을 꼭 2번해야하는데, 여러사람이 리뷰에서 지적했음에도 개선이 안되고있는게 더 문제임"
65,66,20190903,2019,09,03,1,Google 사용자,처음 이체할때 마다 프로그램 자동종료됨 다시로그인 하면 이체되는 현상 수정요청. 그리고 로그인시 인증서 선택을 세번 또는 두번 빠르게하면 공인인증을 같은 횟수로 해야되는 번거러움 존재
66,67,20191024,2019,10,24,1,Google 사용자,간편송금을 가입했는데 몇 번 하고나면 또 가입하라고 나오네요. 그래서 여러번 가입함!
67,68,20190927,2019,09,27,3,Google 사용자,잘 사용했는데..갑자기 로딩시간이 너무 오래 걸립니다. 새로 설치해도 그렇네요.
68,69,20190212,2019,02,12,1,Google 사용자,폰바꾸고 다룬 은행앱은 다 잘깔았는데 이건 왜 안될까요 다운다되고 설치누르면 다시 다운 무한반복이네요
69,70,20200805,2020,08,05,1,김illililli,"진짜 뭣같은어플 , 공인인증서 몇번씩쳐도 전자서명오류 뜨고 한번에 로그인된적없는 최악어플"
70,71,20200407,2020,04,07,1,Google 사용자,기업용 설치시 신분증 사진촬영으로 넘어가지 않고 초기화면으로 돌아가요. 어떻해야하나요
71,72,20200910,2020,09,10,1,seungwon lee,"로그인 오류도 많고, 어플 실행 속도도 느려서 사용하기 굉장히 불편함"
72,73,20200924,2020,09,24,2,kenny ken,앱이 너무 불안합니다. 접속이 끊기거나 느려지기 일쑤에요. 개선해주셔야 할 것 같습니다.
73,74,20210430,2021,04,30,1,김연지,인증서 올해에 정상적으로 받아 로그인 한적도있는데 ㅡㅡ 오랫만에 쓰려고 로그인하는데 정상적이지않다고 오류 메세지뜸
74,75,20200925,2020,09,25,1,고아라,대출 서류를 반드시 앱을 통해 제출하라고 하는데 로그인이 아예 안됩니다. 별 하나도 아깝네요
75,76,20210201,2021,02,01,1,인형같은남자,아니 업데이트 안하나요? 로그인 하면 두번씩해야되고 한번씩 이용자비밀번호칸도 나타나지도않고 이용자비밀번호 쳐야된다하고 그래서 다시로그인해지 도고 제발 개선좀 해주세요 앱 쓰레기같아요
76,77,20210121,2021,01,21,1,photo 2100,로그아웃도 제대로 안되고 시간연장 화면으로 남아 있네요
77,78,20220406,2022,04,06,2,항상러키,이거 입출금 알림이 첨에 몇번오고 계속 안오는데 업뎃 되서 그런가요? 거래처랑 오해가 생기네요.
78,79,20200924,2020,09,24,4,나의키매니아,그지같은 어플만들어놓고 관리하나 제대로 못하나..... 이리저리 불편하네 서버점검 하슈 접속안돼
79,80,20220624,2022,06,24,1,김진태,로그인이 왜안돼죠 아 짜증나
80,81,20210127,2021,01,27,1,강쥐사랑,오류 오류 오류 별하나도 아까워요 로그인 하는데 1시간 걸려..인증서비번 맨날 잘못 눌렀다고..앱을 다시 만들어야 하는데 고객 시간은 왜 허비하게 하나...고객센터 직원분들은 얼마나 이런 전화로 시달릴지...
81,82,20191015,2019,10,15,1,Google 사용자,실행이 안돼요! 몇번을 다시 설치해도 초기로딩화면을 넘어갈 생각을안해요
82,83,20220120,2022,01,20,1,Hoon Hee Bae,폴드1 안드로이드 12 업데이트 후 앱 실행시 그냥 튕겨서 나감...빠른 버전업 부탁합니다...
83,84,20200925,2020,09,25,1,남양주볼라드,네트워크 오류가... 계속 나네요. 다른 뱅킹 앱은 사용이 되네요..
84,85,20211213,2021,12,13,1,오케이마린,인증서 있어도 검색안되고 . 돈주고 다시 받은 인증서도 무용지물 입니다. 갑자기 기업은행 이플만 작동이 안됨
85,86,20200925,2020,09,25,1,B James,다시깔았는데도 오류나요 ㅠㅠ 빨리고쳐줘요 확인을못하겠음 제출하던거도 지워졌을라나
86,87,20200209,2020,02,09,1,Google 사용자,사업자번호랑 계좌번호랑 안맞는댄다 사업자 내고 처음 만든 계좌가 ibk인데 이유를 모르겠지만 개인뱅킹이나 기업뱅킹이나 시스템이 불편한건 똑같은듯
87,88,20220215,2022,02,15,1,코리아링크Korea Link,폴더 1 업데이트 이후로 버그로 계속 튕깁니다 ㅠㅠ 해결책좀 알려주세요.
88,89,20210708,2021,07,08,1,Soon Great,잘되다가 왜 로딩화면만 계속나오나요 빨리 처리부탁드려요
89,90,20200924,2020,09,24,2,이우진,종료 할 때마다 종료가 안 되고 먹통이 됩니다. 갤럭시노트8 입니다...
90,91,20220608,2022,06,08,1,최광일,공동인증서인터넷에서 가져오기해도사라집니다
91,92,20191017,2019,10,17,1,Google 사용자,은행가서 사업자통장.범용공인인증 다했는데요 여기 가입하는데 게속 공인인증서 없다고 나오면 어쩌란건가여? PC가져오기 로 인증서도 가져오고 인증서 관리에도 떡하니 인증서 있는데 게속 없다고 나오면 어쩌란건지 빠른답변 부탁합니다
92,93,20200410,2020,04,10,1,Google 사용자,기업용 계좌개설할때 표준산업분류 콤보박스클릭하면 선택하는게 안뜨네요. 지워도 안보이는데 이럴거면 어플 왜만들었나요?
93,94,20191117,2019,11,17,1,Google 사용자,이 앱을 깔고나서 다른 사용중이던 다른 앱들이 업데이트 하는데 너무시간이 많이 걸리는건 뭣때문일까요?
94,95,20200422,2020,04,22,1,Google 사용자,별하나도아까움 신분증발급날짜까지등록하고도 확인안된다는 ㄸㅁㅊㅇ
95,96,20210630,2021,06,30,1,장정현,인증서 오류라뜨는데요 계좌이체시킬려고했는데 인증서 비번 을칠려하닌깐 안눌러지내요 접속할때는쳐지는데 왜 이체할때만 그러는지모르겠습니다
96,97,20200910,2020,09,10,1,H J,타행에 비해 사용하기 많이 불편해요ㅠㅠ 주거래은행 바꿨는데 후회!
97,98,20220214,2022,02,14,1,김서윤,접속이 안되요 개인은 잘되는데 기업용 접속이안됩니다
98,99,20200904,2020,09,04,1,JY J,고객정보확인하겠다면서 신분증 촬영을 시키는데 제대로 촬영해도 계속 다시 촬영하라는 메시지만 출력됨 . 고객을 무슨 똥개훈련시키는건가?
99,100,20200116,2020,01,16,1,Google 사용자,쓰레기중에 쓰레기네요.. 무슨 할아버지가만든 어플인가 맥없이 픽픽 꺼지고 로그인안되고 너무 구려요ㅜㅜ 진짜 90년대같아 무슨 이런 메이저은행 어플이 이런지.. 나는 자주사용안하지만 기업인들입장에선 개빡치겠네요 진쨔 ㅋㅋ 그 미사용시간 길디고 픽 커지면은 다시 로그인이 안됩니다 ㅋㅋ 어플을 아예 종료한다음 다시켜야됨... 뭔가늙은어플
100,101,20200924,2020,09,24,1,aa,모듈초기화에 실패했다면서 계속 어플 실행이 안됩니다.
101,102,20190305,2019,03,05,3,Google 사용자,비대면 계좌 개설시 안드로이드 9.0 에서는 안되는듯 합니다 가입 진행중 홈택스 인증서 입력하는 부분에서 인증서를 찾을수 없습니다 하고 오류 뜹니다 9.0인 G7 에서 오류가 나서 8.0인 V20 으로 하니 오류없이 가입 되었습니다
102,103,20200407,2020,04,07,1,Google 사용자,이거 공인인증서 4400원 결재하고 설치했는데 로그인할때 왜 안뜨죠? 개선방법이 있나요??
