,id,date,dateYear,dateMonth,dateDay,rating,userName,content
339,340,20211101,2021,11,01,1,청솔,caq_success Callback 오류 뜬지 몇달이 지났는데 왜 업데이트 안되나요
340,341,20220429,2022,04,29,1,스킨핏,아니 갑자기 입출금 알림이 왜안뜨는건가요?
341,342,20201011,2020,10,11,1,영도바보,식당인데요. 직원 월급 입금 안해준다고 출근안했습니다. 은행어플 죄송합니다 메세지만 뜬다고 했더니 무슨 x소리냐고 헛소리하지말라네요.
342,343,20190228,2019,02,28,3,Google 사용자,최근에 로그인할때마다 메세지수신 동의하겠냐는 창이 뜨는데 이것좀 안나오게해주세요
343,344,20191122,2019,11,22,5,Google 사용자,편리하고 유용하게 잘 쓰고 있습니다.
344,345,20190403,2019,04,03,1,Google 사용자,지우고다시깔아도안되요 업데이트확인중입니다
345,346,20200416,2020,04,16,1,Google 사용자,도대체 업종을 어디다가 입력하나요? 지웠다깔아도 똑같네요.
346,347,20210405,2021,04,05,4,kyung o kwon,다좋은데 푸쉬 알림 입출금 알림이 오질않습니다 확인해주세요
347,348,20191122,2019,11,22,5,Google 사용자,너무편하고좋아요 더좋은기능들 업데이트부탁드려요
348,349,20190924,2019,09,24,1,Google 사용자,업데이트 확인 중에서 왜 멈춰있는건가요 일을 못하고 있어요
349,350,20191122,2019,11,22,5,Google 사용자,간편해진 앱과 소액결제나 로그인시 지문등록으로한결편하네요
350,351,20200923,2020,09,23,1,jaebok yu,개인뱅크사용자라 사용할수없다고 뜨는데 개인사업자용 인증서랑 계좌있는데 로그인이 안되네요.확인부탁드립니다.
351,352,20200522,2020,05,22,5,김현근,사용하기 편하게 구성되어있네요 전 개인적으로 대만족합니다
352,353,20210321,2021,03,21,1,Bbo Pak,계속꺼짐 이체해야되는데 로그인도안됨
353,354,20190902,2019,09,02,5,Google 사용자,기업 전용 거래하면서 잘 쓰고 있습니다. 기업용 은행 앱 중에서는 제일 편리한 것 같아요.
354,355,20211029,2021,10,29,1,콩틴,스타뱅킹에서 봤던 상품을 이앱에서는 찾을수없는데 기업뱅킹이면 이용할수 없나요??
355,356,20210709,2021,07,09,1,포캣집사4CatButler,진짜 답답하다... ㅋ 우리는 여러 인터넷뱅킹 어플을 이용하는 사람들이고 그중 유독 국민기업뱅킹이 불편하다고 입을 모아 얘기하면.. 좀 개선을 해보세요.. 고객 센터에 전화해서 들은 답변이라곤 아이디를 다시 만들어보세요 아니면 어플을 한번 지웠다 깔아보세요 면 어플이 문제인거 아닙니까..
356,357,20210407,2021,04,07,5,김현아,사업을 시작하면서 만들게된 kb기업뱅킹 !! 일반 뱅킹보다 입금시 간결하게 만들어져 사용이 매우 편해 대만족입니다.
357,358,20190402,2019,04,02,1,Google 사용자,업데이트에서 안넘어갑니다 기업뱅킹인데 한두번도 아니고
358,359,20210930,2021,09,30,1,황윤선,어플이 아예 설치도 안되는군요. 이름에 걸맞지 않은 모바일 환경임.
359,360,20191113,2019,11,13,5,Google 사용자,원스탑 신규 굉장히 편해요~!
360,361,20211028,2021,10,28,1,김영수,푸시설정 개인앱은 어찌어찌 설정 다시 해놨는데 기업앱은 이건 설정이 된건지 안된거지도 모르겠고 개인앱이든 기업앱이든 앱개발자는 국민은행 안써서 다른사람이 불편하든지말든지 식으로 만든거같아요 진짜 개짜증나요
361,362,20191112,2019,11,12,5,Google 사용자,화면이 깔끔하그 편하네요
362,363,20191025,2019,10,25,5,Google 사용자,화면 구성이 깔끔해서 좋아요
363,364,20210327,2021,03,27,5,YOUNGCHUL YU,사용하기 편하고 너무 좋아요. 유영철
364,365,20210328,2021,03,28,5,이상현,"개인 사업자 주거래 통장으로 사용하는데, 송금 수수료 무료로 아주 요긴하게 사용하고 있네요."
365,366,20190419,2019,04,19,1,Google 사용자,이거 왜 자꾸 이래요?? 업데이트 화면에서 안넘어가잖아요~ 먼저도 이러더니 오늘 또 이러네요.
366,367,20220302,2022,03,02,3,JS YOU,핸드폰 화면에 설치가 왜안되죠? 다른것은 다운받으면 자동으로 화면에 설치가되는데요
367,368,20220221,2022,02,21,1,토미토미,오류떠서 로그인도못하는중 이유도없음 고객님죄송합니다만써있어요ㅋㅋㅋ
368,369,20190419,2019,04,19,1,Google 사용자,하루 종일 업데이트중이라고만 뜹니다.ㅜㅜ 해결좀 해주세요
369,370,20210520,2021,05,20,1,오지영,접속을하면 고객님 죄송합니다 라는 말이 뜨고 로그인이 아예 안되네요
370,371,20191122,2019,11,22,5,Google 사용자,빠르고 편한어플 감사합니다
371,372,20210402,2021,04,02,2,공주,재설치해도 어플이 안들어가져요 ㅠㅠㅠㅠㅠㅠㅠㅠ 하....
372,373,20200519,2020,05,19,5,심성보,너무편리하고 간단하네요
373,374,20200520,2020,05,20,3,다굥,"sub사용자인데 결제관리의 등록한내역의 결재상태,등록취소만 나오고 상세보기 안됩니다"
374,375,20190503,2019,05,03,1,Google 사용자,push알람 설정을 해도 알람이 안울리네요 왜그런가요
375,376,20200227,2020,02,27,1,Google 사용자,이렇게 이용하기 힘든 은행어플은 첨이네요 이용자입장에서 간편하게 해주세요 별한개도 아까워요
376,377,20190823,2019,08,23,1,Google 사용자,겔럭시 텝S3입니다 안된지 아주 오래 되었습니다 한번 검토해주세요
377,378,20191108,2019,11,08,5,Google 사용자,전보다 화면이 더 깔끔해져서 사용하기 좋아요
378,379,20210404,2021,04,04,5,안상철,편리하게 이용할수있어 좋습니다~
379,380,20210404,2021,04,04,5,이정은,이체가 및 조회가 편합니다.
380,381,20190909,2019,09,09,1,Google 사용자,불편해요 이체할때 계좌검색해서 보낼수있어서 좋았는데 검색하는게 사라진건가요??
381,382,20191212,2019,12,12,5,Google 사용자,처음보다 많이 좋아졌어요....빠른 매뉴좋아요.
382,383,20190607,2019,06,07,1,Google 사용자,업데이트 확인중 며칠째냐. IT부서 다 휴가 갔냐? 삭제 후 재설치 해도 같은 현상. 참나 내가 은행을 바꾸고 말지.
383,384,20211127,2021,11,27,1,형정성,0점 어디없냐. 개인용 KB스타뱅킹에서는 기업용공동인증서가 뜨는데 정작 스타기업뱅킹을 까니까 기업공동인증서 뜨지를 않네. 1시간 넘게 삽질하다가 결국 내 개인계좌로 결제했네. 고맙다 바쁜데 시간만 날리게 해줘서 은행 앱이 개인돈날리게도 해주네
384,385,20191122,2019,11,22,5,Google 사용자,잘 애용하고 있습니다. 화이팅!
385,386,20210406,2021,04,06,5,이유진,계속 발전하는 시스템이되세요 화이팅입니다
386,387,20201011,2020,10,11,1,박정원,계속 안되네 ㅡㅡ 아 급한업무 있는데 왜 안되는지 공지라도 알려주던가 내일 바로 딴 은행으로 갈아탑니다 사업자랑 개인 다쓰고있겄만
387,388,20210221,2021,02,21,1,김말이,맨날 공인인증서 오류나고 짜증남. Pc버전이든 뭐든 모든 편의성 최하. 인터넷으로 안돼서 해당 문제를 직접 해결하려고 은행 가도 직원들도 해결할줄 모름. 고객센터도 해결할줄 모름. 옛날엔 홈택스랑 쌍벽으로 열받게하는 투톱이었는데 이젠 1위임. 기업용 공인인증서 별짓 다해도 갱신안되길래(위 사례) 결국 기한지나 폐기돼버리고 외부에서 돈주고 등록함. 그러니이번엔 타행이라등록안된대서 등록하려니 사업자번호잘못쳤다고 그러는데 사업자 멀쩡하게 잘 쳐도 이난리임. 어케 아이디든핸폰번호든 뭔짓을 다해서 뚫으면 또 그런회원 없다는식으로 나오는듯. 그래서 고객센터 전화하면 은행가라함. 은행가면 뭔소린지 못알아듣고 문제해결 못해줌. 그냥 무한 수렁임. 절대해결안됨 박살내고싶음. 10년넘게 써오고있는데 혜택도 젤구리고 기업등록 여기로 안했으면 진작 갖다버릴은행.
388,389,20200615,2020,06,15,5,서기성,KB뱅킹좋아요 자주 이용하고있어요~~항상 응원합니다^^
389,390,20210406,2021,04,06,5,김현숙,언제든 사용하기 편리해서 좋아요
390,391,20190924,2019,09,24,1,Google 사용자,이거 업데이트 확인 확인 이후로 왜 안 넘어가냐
391,392,20200716,2020,07,16,5,문영례,도움이되는 광고도 있는거 같네요.
392,393,20191122,2019,11,22,4,Google 사용자,가끔 느리지만 잘됩니다
393,394,20210325,2021,03,25,5,Amazing Asian Adult,오류 없고 쓰기도 편하네요
394,395,20220302,2022,03,02,1,권순희,기업뱅킹 만드는데 1일이체한도를 적었는데 왜 자꾸 또 적으라고 알림이 뜨는거죠? 아 진짜 딴것도아니고 은행어플을 이런식으로 만드나요. 이래가지고 어플로 믿고 거래 가능하겠나요?
395,396,20211126,2021,11,26,5,1센터1부김동우 차장,너무 편리하게 바뀐거 같아 너무 좋네요
396,397,20210520,2021,05,20,1,치양이,오류투성 접속이 왜케안되!@
397,398,20191122,2019,11,22,5,Google 사용자,소액 이체 때도 otp가 필요했는데 생체인식으로 언제 어디서나 보낼수 있어서 좋아졌어요
398,399,20220214,2022,02,14,2,윤신철,계속 오늘 하루종일 네트워크불안하다고 로긴이 안되네요
399,400,20190312,2019,03,12,1,Google 사용자,업데이트확인중 에서 안넘어가요 답답합니다
400,401,20191012,2019,10,12,1,Google 사용자,저는 국민은행을 주거래로 해서 개인과 회사두개를 국민은행에 거래하는데 다른 은행도 하지만 로그인할때 정말 불편합니다 공인인증서가 다른 어플은 다보이지만 국민은행 기업 앱은 딱 2개만 순서대로 보입니다 그럼 안보이는 회사는 로그인을 할수가 없습니다 황당합니다 그래서 접속을 할수가없어요 그렇다고 할때마다 공인인증서를 삭제하고 다시 깔고 이짓을 반복해야하니 다른은행으로 바꿀까 생각중입니다 넘 이체나 계좌 잔고 조회힘드네요 국민은행은 딱 한개만 하라는 건지 알수가없내요
401,402,20190408,2019,04,08,1,Google 사용자,진짜 거지같다 대한민국 국민은행이 어플하나 못만져서 지웠다 깔아야 입금되고 또 쓸려고하면 지웠다 다시깔고 부팅도 해야함 은행 바꾼다
402,403,20191122,2019,11,22,5,Google 사용자,편하게 잘이용합니디ㅡ.
403,404,20210401,2021,04,01,1,김진일,지우고 새로 깔아도 자꾸안되네여 ㅠㅠㅠㅠ이젠 앱실행이안되네요 미치겠네요 ㄷㄷㄷ
404,405,20190915,2019,09,15,1,Google 사용자,업뎃하고왜이래요?느리고 쓰는데 편하지도않고
405,406,20190405,2019,04,05,3,Google 사용자,push 설정해도 알림이 안옵니다. 저만 그런가.
406,407,20190704,2019,07,04,1,Google 사용자,별 준사람꺼 뺏고 싶습니다.기업용인데 업무에 지장이 장난 아니네요 진짜 짜증나서 타 은행 계좌 계설 하러 갑니다 진짜 몇번째야 개선이 없냐 진짜
407,408,20210323,2021,03,23,1,잘보인다,별하나도 아깝네.. 업뎃이 안대는걸 어찌 쓰라고 만든건지.. 구글 에서 업뎃이 안대잔아...이런걸 왜 써야하냐고? 다시 전에 쓰던 은행을 써야 하는건지? 에휴
408,409,20210429,2021,04,29,3,진창호,앱에서는 스타CMS가 영영 안되는건가요? 어플에서 스타cms 배너보고 가입했는데 어플에서는 안되고 pc뱅킹으로 해야 수수료 면제 되는건가요?
409,410,20200517,2020,05,17,5,송경수,유용하게 잘 사용하고 있습니다. 깔끔해서 좋습니다.
410,411,20200522,2020,05,22,4,Kyungsik Lee,쓰기편하고좋아요
411,412,20190404,2019,04,04,1,Google 사용자,왜 업데이트에서 화면이 안넘어가나요?
412,413,20200523,2020,05,23,5,TroubleMaker L,사용하기에 편하고 정말 좋습니다 :)
413,414,20190403,2019,04,03,1,Google 사용자,수신동의좀 그만하자 접속할3ㅐ마다하는건 아니잔아
414,415,20191122,2019,11,22,5,Google 사용자,제일 잘 애용하는 앱이에용♡ 좋아요~
415,416,20210907,2021,09,07,1,손아름,계속 네트워크환경이 불안정하다고 안되는데 저만그런가요?ㅜ
416,417,20191105,2019,11,05,5,Google 사용자,새로운 기능 참 좋네요. KB도 할 수 있었네요.
417,418,20211221,2021,12,21,1,윤선,즈그들 꼴이 대기업인데 어플을 이따위로 그지같이 만드네. 렉 더럽게 걸리고 도대체 언제까지 공동인증서러는 디지털 쓰레기로 고객들 피곤하게 만들건가? 아니 잘 되기라도 하던가. 입출금 알림설정은 또 왜 쳐안되는건지? 진짜 어플 역겨워서 토악질이 나오네. 그러니까 카뱅한테 고객 다 쳐뺏기지. 어휴.
418,419,20200615,2020,06,15,5,Boyoung Yoon,KB 인터넷 뱅킹 사용하기 편하고 좋아요!
419,420,20201012,2020,10,12,1,박소정,삭제후 리다운로드하려 하는데도 안되고 대표전화도 대기인원이 많은데 지금 업무처리는 밀려있는데 어떻게해야될질모르겠네요
420,421,20211107,2021,11,07,1,김난희,입출금 알림설정을 했는데 알림이 안오네요
421,422,20210402,2021,04,02,1,짱구는몸만져,네트워크가불안정하다고실행이안되네요
422,423,20190401,2019,04,01,1,Google 사용자,들어가지질 않네 지우고 새로 깔아도 안들어가지네 ㅋ 기업뱅킹을 막아놓으면 어쩌나는 건가요
423,424,20190523,2019,05,23,1,Google 사용자,인증서 내보내기 실패했다는 말만 반복됨
424,425,20210904,2021,09,04,1,김유동,앱스토아에서 다운이안되요 하루종일 짜증나네요
425,426,20191122,2019,11,22,5,Google 사용자,kb뱅킹 매번사용하는데 타은행 앱보다 사용하기 편합니다
426,427,20210404,2021,04,04,5,배순주,편리하게 잘사용하고있습니다
427,428,20200730,2020,07,30,3,윤란규,입출금 알림기능없나요? 개인사용자는 별도의 어플이 있던데 사업자는 어떻게 입출금 알림설정이 가능할까요
428,429,20190608,2019,06,08,2,Google 사용자,타은행은 점점 이용이 간편하게 업데이트 되는데 비해 국민은행 기업배킹서비스는 몇년째 제자리 걸음인것 같네요..공인인증서 비번누르고..어쩌고 그러다보니 답답하고 불편해서 점점 안쓰게 되네요..다른데처럼 좀 간편하게 개편하실 마음은 없으세요?
429,430,20191122,2019,11,22,5,Google 사용자,간편하고 편리해요
430,431,20210325,2021,03,25,5,박민지,편리하게 잘 사용하고 있습니다^^
431,432,20191120,2019,11,20,5,Google 사용자,오랫만에 새로워져서 그런지 예전보다 많이 편해졌습니다
432,433,20200522,2020,05,22,5,박경희,사용해보니 좋네요. 개인사업자에게 꼭필요할것같아요.
433,434,20200619,2020,06,19,1,Seul Kim,홈 버튼만 누르면 작동이 안되요...
434,435,20210922,2021,09,22,1,박서현,설치 조차 되지않네요...왜그런건가요? 스타뱅킹은 다 깔려있는데 기업뱅킹은 왜이런거죠?
435,436,20210520,2021,05,20,1,김건,"One stop 계좌 개설 중 상호명을 적을려고 하는데, 원래 상호명인 가나다(Kanada)라고 적으면 괄호 안의 Kanada만 인식되고, 가나다 라고 적으면 가나다(Kanada)라고 안적었다고 진행이 안되고, Kanada 라고 적으면 가나다(Kanada)라고 안적었다고 진행이 안되고, (가나다(Kanada))라고 적으면 나중에 상호명을 작성해달라고 안되네요. 도대체 어떻게 예외처리를 했는지는 몰라도, 개발자 분들은 그냥 쳐 주무셨나요?? 상호명에 괄호가 들어갈 일은 많을텐데 이정도 예외처리도 안하고 개발자라고 하시는건가요?"
436,437,20210331,2021,03,31,5,Jusuk Lee,사용하기편하고 좋아요 역시 KB입니다 최고
437,438,20210110,2021,01,10,1,jinhun lee,드럽게 불편함. 결국 영업점 가서 해결해야 함.
438,439,20200923,2020,09,23,1,루카,나만 대출신청할때 공인증서 비번 입력하고 안넘어가나요?
439,440,20190904,2019,09,04,1,Google 사용자,하.. 사업자통장은 kb모바일인증서로 쓰고있었는데 이앱에서는 쓸수가없네요 방법 없을까요?
440,441,20191025,2019,10,25,5,Google 사용자,지문인증 없더니 생겼네요. 훨씬 나아졌네요.
441,442,20210325,2021,03,25,5,도인성,편리하고 좋아요
442,443,20191111,2019,11,11,5,Google 사용자,편리하고 좋아요
443,444,20200409,2020,04,09,1,Google 사용자,모바일 otp도 안되고...
444,445,20191122,2019,11,22,5,Google 사용자,굉장히 편리합니다
445,446,20210822,2021,08,22,1,이완수,국민은행 이 주거래 은행이다 공동인증서를 발급받아 그 공동 인증서를 요구 하는 곳에 사용 하려 하지만 만날 실패라는 자막만 뜬다 오늘도 몇시간 컴 앞에서 시간만 보내게 되었다
446,447,20191025,2019,10,25,1,Google 사용자,평일 오전처럼 거래량 많을때 앱실행이 안되는 경우는 어떻게 해야하나요
447,448,20200519,2020,05,19,5,김태미,기업용 뱅킹이 따로 있어서 좋네요! 편하게 이용하겠습니다~
448,449,20191122,2019,11,22,5,Google 사용자,빠른이체생겨서편해요
449,450,20200519,2020,05,19,5,문종원,간편하고 사용하기 좋네요
450,451,20200519,2020,05,19,5,조호용,사용하기 편해서 자주 쓰고 있어요
451,452,20191122,2019,11,22,5,Google 사용자,국민은행 짱이얘요.요즘 빠른이체할수 있어도 더 좋아요
452,453,20191025,2019,10,25,5,Google 사용자,너무 편리해서 좋아요~^^
453,454,20210329,2021,03,29,4,이해주,기업 뱅킹이 따로 있어서 간편하게 사용가능해서 좋아요^^
454,455,20201011,2020,10,11,1,박군,아니거래처입금해줘야 물건을받는데 왜안되는거야대체!승질나게!
455,456,20210402,2021,04,02,3,beat logic,로그인 계속안됨 리뷰보고 V3삭제.국민 삭제 다 하고 다 다시깔아도 안됨 왜이런거죠ㅡㅡ 언제되나요
456,457,20210402,2021,04,02,3,강재준,네트워크가 불안정하니 잠시후다시 시도하라는데 왜?
457,458,20210325,2021,03,25,5,손진무,얼마전 기업쪽 은행거래 할 일이 있어서 쓰게됬는데 편하고 특히 이체나 외환쪽에 따로 은행을 방문하지 않아 좋습니다
458,459,20200519,2020,05,19,1,park robin,기업통장 만들려니 공인인증서 만들어야 하는데 ID 넣으라는데 개인회원 ID는 안되고 도대체 뭘 넣으라는건지..아무리봐도 자세한 설명도 없고..은행 안가고 진짜 사업자통장 만들수 있는건지 의문이 든다.짱나서 기업은행 깔았는데 5분안에 깔끔하게 된다.
459,460,20191122,2019,11,22,5,Google 사용자,사용하기 편해서 좋아요 대신 걱정도 되네요
460,461,20210328,2021,03,28,5,김정희,금융권 기업뱅킹 중에 탑이라 확신합니다 이용하시면 다양한 혜택이 있습니다
461,462,20211206,2021,12,06,3,인피 1nFi,로그인이 갑자기 안 됩니다..인증오류라고 뜨네요 수정 해주세요
462,463,20191122,2019,11,22,5,Google 사용자,지문인증생기고 넘편해졌어요 감사합니다
463,464,20191122,2019,11,22,5,Google 사용자,사업장에서 쓰는데는 이것만큼 좋은게 없는 것 같아요 ㅎㅎ
464,465,20191017,2019,10,17,1,Google 사용자,앱이갑자기 멈추고 사용도불편 카뱅 반만이라도 따라하던가해라 어쩔수없이 쓰는데 별 1개도 아까움
465,466,20200522,2020,05,22,5,박화영,사용해보니 편해요. 자주 사용합니다.
466,467,20210329,2021,03,29,5,benkwon권예준,사용하기가 편리하게 되어 있어요.
467,468,20191122,2019,11,22,5,Google 사용자,옃년째 계속 쓰구있어요 ♡ 좋아요오류없고~역시 국민👍
468,469,20201012,2020,10,12,1,권언정,업데이트후 왜케 느리고 안되나요???!!
469,470,20210225,2021,02,25,5,jae wook jung,업데이트후 간편해서 좋아내요
470,471,20191122,2019,11,22,5,Google 사용자,여러사업자통장을 싱글사인온으로 관리할 수 있어 편리!
471,472,20191122,2019,11,22,5,Google 사용자,사용하기 너무편하네요 좋아요
472,473,20200910,2020,09,10,1,Sunyoung Kim,주소입력안됨 아니무슨 이렇게 큰 금융회사에서 이런 초보같은 오류가 나나요. 몇번시도해도 안되서 포기하고 다른은행으로 갈아탑니다
473,474,20191122,2019,11,22,5,Google 사용자,예전보다 훨신 사용하기 편리해졌어요
474,475,20191122,2019,11,22,5,Google 사용자,편리한 사용 환경
475,476,20210405,2021,04,05,5,김윤희김윤,이체할때 수수료 없구 편함
476,477,20191122,2019,11,22,5,Google 사용자,잘쓰고있습니다 불편함 없네요~
477,478,20210323,2021,03,23,1,Yj Cho,앱 무한로딩 문제가 있습니다. 해결이 안돼서 답답합니다
478,479,20191122,2019,11,22,5,Google 사용자,지문인식 편리해요
479,480,20190408,2019,04,08,1,Google 사용자,설치가 안되요 계속 대기중이라고뜨네요
480,481,20210406,2021,04,06,5,이주희,사업자 통장으로 잘 쓰고 있어요..소상공인 여러분 번창하세오
481,482,20210325,2021,03,25,5,승현,기업뱅킹이 익숙해지면 수수료없는 송금이 장점입니다
482,483,20200519,2020,05,19,5,전성동,편리하고 좋습니다.
483,484,20191122,2019,11,22,5,Google 사용자,사용하기 편하고 좋네요~^^
484,485,20210325,2021,03,25,5,Mossad Kidon,안전하고 빠른 KB스타기업뱅킹!
485,486,20190930,2019,09,30,1,Google 사용자,업데이트가 너무 느림
486,487,20190626,2019,06,26,3,Google 사용자,테블릿에서 전체메뉴가 안나옵니다
487,488,20191025,2019,10,25,5,Google 사용자,조회가 스타뱅킹과 비슷해져서 보기 편합니다.
488,489,20210328,2021,03,28,5,김해피,편리하게 잘 되어 있네요
489,490,20190709,2019,07,09,1,Google 사용자,답변을 붙여넣기 하고 앉았네 빠른 조치를 취하던가. 당신네들만 은행이요? 내 처음으로 리뷰를 쓴다만 이딴걸로 리뷰를 달게 하네. 재설치해도 안되니까 빨리 조치 취하세요
490,491,20210323,2021,03,23,5,김정수,자세한 설명 감사합니다. 덕분에 잘 처리했습니다.
491,492,20190306,2019,03,06,3,Google 사용자,국민기업카드 이용내역은 어디서 확인하는지요? cms가입도 안되고 마이비즈앱은 회원가입이 안되어있다고 하고ㅜㅜ
492,493,20191026,2019,10,26,5,Google 사용자,업데이트이후에많이편리해졌네요
493,494,20220108,2022,01,08,1,부동산수호천사,물레방아만 계속~~ㅠㅠ 왜 갑자기 이런거죠?
494,495,20220722,2022,07,22,2,김명근,ㅇㅇ 좋아MK1221 좋아 좋아 ㆍㅎㅈ ㅣㅣ기ㅣㅣㅣㅣㅣㅣㅣㅣ기
495,496,20211124,2021,11,24,1,신종운,또 공지도 없이 사용자가 많아서 안된다고만 뜨는 다른은행으로 갈아 타야지 지점에 일부 직원들이나 어플이나 똑같이 쓰레기임 깔지 마세요
496,497,20191122,2019,11,22,5,Google 사용자,기능이 많아서 유용해요
497,498,20191122,2019,11,22,5,Google 사용자,편하게 잘쓰고있어요~
498,499,20190630,2019,06,30,1,Google 사용자,업데이트 확인 중에서 안 넘어감ㅡㅡ 몇일째 거래 은행 바꾸고 싶음
499,500,20200519,2020,05,19,5,굳우왕,너무나 잘쓰고있습니다
500,501,20190516,2019,05,16,4,Google 사용자,이거 기업용은 입출금될때 앱 알림서비스는 안해주나요? 안되는거 같은데...
501,502,20210316,2021,03,16,1,leeves keanu,계좌이체하려는데 왜 계좌 입력란에 회색음영처리 되서 계좌번호가 안써지게 하냐 빨리 고쳐라
502,503,20220422,2022,04,22,3,Jong Hyun Bae,입출금 실시간 푸쉬알람 잘오다 계속 안와요. 새벽3시쯤에 가맹카드사 입금알람 왔는데. 낮엔 오는데 새벽에 푸쉬알람 안가도록 한건가요?
503,504,20220511,2022,05,11,5,홍두표,잘 사용하고 있습니다~
504,505,20200323,2020,03,23,1,Google 사용자,어느날부터 열어지지도 않고 새로 깔아지지도않네요
505,506,20191122,2019,11,22,5,Google 사용자,좋아요!너무 편해요!
506,507,20190308,2019,03,08,1,Google 사용자,공인인증서를 가져와도 이앱에서는 안보이네요
507,508,20191031,2019,10,31,1,Google 사용자,다운이안됩니다 갤럭시노트 10인데 ㅠㅠ
508,509,20210214,2021,02,14,5,Nals bike,ㅇㅣ체시 하단 팝업 잘못눌러서 짜증이낭
509,510,20191122,2019,11,22,5,Google 사용자,넘잘쓰고있어요! 편해요
510,511,20200519,2020,05,19,5,Jae Won Lee,기업뱅킹 사용하기 편하네요!
511,512,20210817,2021,08,17,1,이종태,쓸데없는 앱들이 왜이렇게 많아? 귀찮게시리.
512,513,20220128,2022,01,28,1,정숙희,96~98%에서 넘어가지않고 설치가 안되네요 -.-
513,514,20210323,2021,03,23,5,김재관,신속한 응대에 감사드립니다.
514,515,20191122,2019,11,22,5,Google 사용자,넘 편하고 좋아요
515,516,20200204,2020,02,04,1,Google 사용자,거래처 입금중 너무 빡쳐서 평가 단다 그놈의 응답대기초과점 고쳐주라 개빡친다 별한개도 아깝고 쓸데없는 업뎃 하지 말길
516,517,20200426,2020,04,26,4,Google 사용자,아주 유용하게 사용합니다
517,518,20200615,2020,06,15,5,JJ Lee,너무 잘 쓰고 있어요
