,id,date,dateYear,dateMonth,dateDay,rating,userName,content
191,192,20190903,2019,09,03,1,Google 사용자,노트9 사용자입니다 하루 종일 업데이트확인중이라고 앱에 들어가지가 않네요 잘되던게 갑자기 이런 ㅡㅡ 기업업무고 뭐고 급한 뱅킹업무는 하지도 못하고 지금 이런 증상이 있는지 담당자분들은 알고 계신가 모르겠네요 이 정도면 정말 심각한 수준이네요 광고비 쓰는 예산있으시면 IT예산도 좀 늘리시는게 어떨까요???
192,193,20191107,2019,11,07,5,Google 사용자,새롭게 앱을 바꿨나봅니다! 오랫만에 들어왔는데 이체가 편해져서 괜찮은걸요.
193,194,20191122,2019,11,22,4,Google 사용자,너무 다양하게 있는 어플 그중에 조금씩 개선 되어 가는 점점 편해지네요
194,195,20201012,2020,10,12,1,노재용,앱이 로그인이되야 사용하던지 말던지 할텐데 업데이트이후 되지를않네요
195,196,20220603,2022,06,03,4,강영란,사용하기 쉬워요
196,197,20191001,2019,10,01,1,Google 사용자,업데이트하고나서 최악입니다. 느려졌고 이전보다 눈에 안들어오고 차라리 이럴거면 업뎃 왜 했나요? 십년째 주거래은행이라 울며 겨자먹기로 쓰곤 있는데 진짜 은행 옮기고 싶을 정도입니다.
197,198,20210215,2021,02,15,3,김무역왕,"계좌이체 할때마다 otp , 비밀번호 입력하기 귀찮은데 지문등록 하는 경로좀 알려주세요 도저히 못찾겠어요"
198,199,20191113,2019,11,13,5,Google 사용자,퀵급여이체 편하고 좋네여. 이제 은행 안가도 간편하게 할수 있어서 좋아요~
199,200,20200615,2020,06,15,5,최빈경,빠른이체서비스 완전 강추해요 급하게 이체할때 지갑없이 나갔은때 짱 조아요
200,201,20210402,2021,04,02,5,신정숙,자주사용하는 KB스타기업뱅킹이 간편하고 좋아요. 불편함이 없는 관리에 지지를 보냅니다
201,202,20210401,2021,04,01,5,Lea Choi,잘 쓰고있어요. 다른 기업뱅킹보다 인터페이스가 편리해요
202,203,20220323,2022,03,23,1,코발트블루,별 한 개도 아깝다. 입출금 알림 안 들어옴. 고객센터 전화하니 KB스타알림 어플 깔고 등록해야 한다길래 설치하고 계좌 조회하는데 안 나옴. 거지같은 KB...세상에 어떤 멍청한 은행이 은행어플 따로 알림어플 따로 만드냐? 욕나오게 만드는 재주가 있네.. 어플 거지같아서 주거래 은행 갈아타야겠다
203,204,20191015,2019,10,15,1,Google 사용자,"계속 사용하던 어플인데, 갑자기 실행이 안되요. 다시 재설치했는데도... 사업용으로 사용해야하는데, 이래도 되나요?"
204,205,20190920,2019,09,20,1,Google 사용자,입출금시 핸폰에 메시지 뜰때 메모하기 누르고 메모하면 메모하기 저장 실패 라고 뜸!!!
205,206,20210323,2021,03,23,1,배한규,요새 왜 갑자기이렇게 어플이 느려졌죠.. 업데이트 좀 해주세요 로그인창 기다리는것만 2분걸려요
206,207,20211114,2021,11,14,5,심윤광,10년넘게 국민기업뱅킹만 주거래로 씁니다. 개편한 홈화면 알림정보 덕에 일정관리가 쉬워졌어요 입출금알림푸쉬도 편리해 졌네요.
207,208,20191122,2019,11,22,5,Google 사용자,직관적인거같으면서도 실제사용해보면 답답한경우가있네요
208,209,20190321,2019,03,21,1,Google 사용자,"업데이트에서 하루종일 멈춰있는데, 급한 업무 보는데 난감하네요"
209,210,20190921,2019,09,21,1,Google 사용자,실행이 안됨 업데이트 화면에서 넘어가질 않음 은행어플중에 제일 허접
210,211,20191122,2019,11,22,5,Google 사용자,그전거보다 우선보기편하고 사용할때 간편해저서 아주좋았습니다.^^
211,212,20190419,2019,04,19,1,Google 사용자,간편로그인 좀 만들어 주세요 간단한조회를 빠르게 이용할수있게
212,213,20210402,2021,04,02,1,망구,재설치해도 어플 실행이안됩니다 사이트도 먹통이던데 얼른 고쳐주세요...
213,214,20190407,2019,04,07,1,Google 사용자,요즘 kb 문제임. 알림은 무한로딩 은행엡은 무한업데이트.
214,215,20191122,2019,11,22,5,Google 사용자,로그인 잘차가 공인된 생채인식으로 햐니까 안전성과신뢰성 그리고 빠른속도 1석3조로 좋아요 공인인증서 암호입력과뭐시기 입력 번거로웠는데 이젠편하게 사용 해요
215,216,20191122,2019,11,22,5,Google 사용자,이제 지문인식도 되어 너무 편리합니다~~ 추천합니다!
216,217,20210329,2021,03,29,5,타락1004,이체 편하게 이용하고 있어요. 수수료도 없고 사용 하기 좋네요.
217,218,20201015,2020,10,15,1,정경호,업데이트초확인초기화면에서 왜 안넘어가나요? 이체늘 빨리해줘야되는데 요세 오류가 너많네요
218,219,20211213,2021,12,13,4,김미경,"이체시 받는 분 통장메모를 쓰지않을 경우 자동으로 예금주명이 기재되는데요, 기업뱅킹 계좌가 주로 사업용계좌이다 보니 예금주명이 성명(상호명)으로 되어있습니다. 다른 분들은 어떠실지 모르겠는데, 보통 거래처에 이체시 성명은 빼고 상호명만 기재하기 때문에 이체시 매번 (성명을 뺀) 상호명을 일일이 써야 해서 불편하더라구요. 쓰다가 틀리는 경우도 있구요. 처음부터 받는 분 통장메모에 예금주명이 기재되어 있으면 불필요한 부분(성명)만 지우면 되기 때문에 더 편하지 않을까 싶어요."
219,220,20191220,2019,12,20,3,Google 사용자,Star cms 서비스 신청가입 에서 응답이 없고 멈춥니다~어떡해 해야 이용 가능한지 알고 싶습니다
220,221,20220315,2022,03,15,1,장재호,앱 개같다고 쓰니까 리뷰 왜지우는거야ㅡㅡ 인증서 가져오기도 하고 재발급도 하고 그 인증서로 다른거 다되는데 왜 이 어플 로그인 하면 인증서 없다하냐고
221,222,20190528,2019,05,28,1,Google 사용자,마케팅 수신 싫다는데 킬때마다 계속 물어보는거 아주 짜증나죽겠습니다
222,223,20210909,2021,09,09,1,나자신,핸드폰이 바뀌어서 새로 설치했는데 업데이트 확인중 이후로 넘어가질 않음
223,224,20210326,2021,03,26,4,박쓰리,"지금현재 만족스럽지만,자료조회할때조금 미비한점만 업시켜주심감솨."
224,225,20211110,2021,11,10,1,Jung SKY,11월8일부터 개선된다면서 뭐가 된거지?? 니네 때문에 입출금을 수시로 어플 열어서 확인한다. 몇년째!! 써글놈들아 말만하지말고 제대로 해달라고!! 아 스트레쓰
225,226,20210325,2021,03,25,5,최기현,로그인시 지문인증 등 편리함이 많이 개선되었네요^^~
226,227,20210328,2021,03,28,5,Hyeweon Chung,매우 편하게 만들어졌어요. 덕분에 은행가지 않고 잘 사용합니다.
227,228,20201218,2020,12,18,4,청춘NANA,대출상환 (일부상환) 할때 본인 추가인증 절차에서 계속 오류떠요 삭제후 재설치하면 되고 또 나중에 하려면 안되고..매번 삭제후 재설치.. 빠른 개선 바랍니다
228,229,20191212,2019,12,12,5,Google 사용자,"이체, 예약이체 등 편리하게 앱이 구성되어 좋습니다."
229,230,20190924,2019,09,24,3,Google 사용자,업데이트 확인중에서 안넘어가요 불편해요 빠른조치 부탁드립니다
230,231,20210401,2021,04,01,4,YJ P,인터페이스 편리하고 매일 매일 잘 사용하고 있습니다
231,232,20220421,2022,04,21,1,김그레고리,"너무 복잡하고 불편하고 그래서 짜증나고 주은행이라 안할수는 없고, 별 반개"
232,233,20220301,2022,03,01,1,남허두회,지문인증 유효기간 만료라고해서 10번을 넘게 재등록을해도 계속 만료라고만 나옵니다 갑자기 오류인지 뭔지 영업점을 방문하게 만드는겁니까
233,234,20191107,2019,11,07,5,Google 사용자,3번 접속하고 조회로 갔어야했는데 요샌 바로 조회화면 보여주니 편합니다.
234,235,20200102,2020,01,02,4,Google 사용자,최근 앱 이체시 에러코드번호 caq70013 가 자주 뜨면서 이용을 못해 불편을 겪고 있습니다 문제해결방법을 알려주세요
235,236,20200527,2020,05,27,3,백선형,불편한 부분들이 많이개선되어 스타기업뱅킹 쓰기가 많이 좋아졌습니다 기존에 기업들이 뱅킹에서 안되서 불편했던 부분들에 대한 개선노력이 엿보여 감사드립니다
236,237,20200501,2020,05,01,1,윤씨네5,로그인 하려는데 기업용 전자세금계산서가 공인 인증서 목록에 뜨지 않습니다. 어떡해 해야하나요?
237,238,20191111,2019,11,11,5,Google 사용자,앱 사용하기 편리하고 유용합니다 만족하며 사용중입니다~
238,239,20191025,2019,10,25,5,Google 사용자,급여이체가 편해서져서 좋습니다. 계속 신경써주십시요.
239,240,20191122,2019,11,22,5,Google 사용자,타 기업뱅킹보다 편하고 빠르며 UI가 쉽습니다
240,241,20210503,2021,05,03,1,김지현,갑자기 공인인증서 로그인이 안되네요^^;;;급하게 송금 보내야되는데 난감했네요ㅜㅜ
241,242,20220102,2022,01,02,1,방,당췌 깔리지가 않네요.. 로딩만걸리고.. 왜 이런건지.. 아이폰엔 깔리는데 안드로이드엔 왜 안되나??
242,243,20200429,2020,04,29,1,T3,로그인 왜 안됩니까ㅡㅡ 빨리 복구하세요ㅡㅡ 잘쓰던 어플을 왜 거지같이 만드는지..
243,244,20210331,2021,03,31,5,금천에산다,너무 편하게 잘 사용하고 있습니다 기업도 개인처럼 오픈뱅킹도 사용하면 좋을거 같네요
244,245,20200522,2020,05,22,5,munuk kim,UI가 직관적이어서 편하게 사용가능하네요.
245,246,20190918,2019,09,18,3,Google 사용자,빠른이체로 타행이체할때 내통장메모가 삭제됩니다 조치부탁드립니다
246,247,20210322,2021,03,22,3,하늘이와 구름이의 일상,자꾸 네트워크 불안정하다고 하면서 앱이 열어지지가 않네요..노트10+ 입니다
247,248,20191004,2019,10,04,3,Google 사용자,지금 앱 실행이 안되는데 무슨 문제인가요.. 휴대폰은 노트10입니다만.. 해결해주시길 바랍니다.
248,249,20210326,2021,03,26,5,JEONG AE HAN,사업자에게 편리하게 구성된 메뉴가 보기 좋습니다
249,250,20220110,2022,01,10,1,Chloe Cha,이체 금액 자동으로 보이는기능 꺼주세요 그것때문에 사용하기 불편해요
250,251,20190625,2019,06,25,1,Google 사용자,어플좀 개선 하십시오 은행가면 상품만 팔아 재낄려고 하지말고 뭐만 하면 접속도 안돼. 인증서 기간 연장도 불편해. 송금할때는 1.비번 2.인증서 3.오티피 4.또 인증서 ㅋㅋㅋ 아오 불편해
251,252,20191122,2019,11,22,5,Google 사용자,사용자의 편의성에 알맞게 잘 제작했네요. 절 쓸께요. ^^
252,253,20220412,2022,04,12,5,낚시금지,편리한 앱 감사 합니다
253,254,20211201,2021,12,01,1,ghasha cat,"One Stop 신규 이용하려고 설치했는데 근 두시간 가까이 속에 화만 쌓이고..결국 관뒀습니다.별 오잡 오류가 나면서 튕기고 멈추는데 하다하다 신분증 촬영 다음에 깨진 문자열 등장하는건 뭐요..? 이거 뭐 베타 버전같은건가요?아님 상성폰에만 테스트 하신 건가? 갤럭시가 없어서 내 타기종 테스트까진 못해주겠고, 그냥 휴가내고 영업점 방문합니다. 업무 끝나면 그냥 은행을 옮기는게 편하겠어요."
254,255,20190521,2019,05,21,1,Google 사용자,업데이트중이라면서 진행 1도 안돼요 너무 불편해요ㅠㅠ
255,256,20210407,2021,04,07,5,박종석,타은행에 비해 빠르고 손 쉽게 사용가능해서 좋아요 국민은행 화이팅!
256,257,20191003,2019,10,03,1,Google 사용자,핸드폰바꾸고 몇번되더니 업데이트확인중에서 멈춰잇네요ㅠㅠ
257,258,20190429,2019,04,29,1,Google 사용자,삭제 후 재설치해도 '업데이트 확인 중'이라고만 뜨고 안됩니다. 몇일째 몇번을 지웠다 다시깔아도 그러네요. 은행 앱이 이래도 되나요? 황당합니다...
258,259,20191122,2019,11,22,5,Google 사용자,좋습니다. 지문인증과 빠른이체로 성공적
259,260,20211031,2021,10,31,2,이채현,폰바꿨는데 로그인이 안돼요. 이전폰에서는 어떻게 썼던건지ㅠㅠ
260,261,20191025,2019,10,25,5,Google 사용자,화면구성이 좋아서 급여이체도 편하게 했어요
261,262,20210123,2021,01,23,1,kim swan,돈 놀이만 하지 말고 불안정한 어플 좀 더 편리한 어플 개발줌 합시다. 거래처 때문에 어쩔 수 없이 쓰긴 하는데 이건 해도 너무하다.
262,263,20210407,2021,04,07,5,커피향기폴폴,너무 편리하고 메뉴도 찾기쉬위요. 👍
263,264,20190612,2019,06,12,1,Google 사용자,외 업데이트 확인중으로 나오면서 접속이 않되나요??? 답답해 죽어요~~!!!
264,265,20201016,2020,10,16,1,최재호,로그인안됩니다 간헐적인 정도가 아니라 안됩니다
265,266,20211212,2021,12,12,1,CHANO MOON,스태뱅킹 어플은되는데 알림이랑 기업뱅킹 어플이 네트워크오류라고 재설치해도 실행이 안되네요
266,267,20190823,2019,08,23,1,Google 사용자,생체인식 업데이트 도대체 언제 해주는거요? 참내 반년을 넘게 기달려도 안대네요... 업무상 기업앱을.많이 쓰는데 불편해 죽겟다고요
267,268,20191122,2019,11,22,5,Google 사용자,편하고 빠른 스태뱅킹 항상 잘 쓰고있습니다
268,269,20210118,2021,01,18,1,Jei J,맨날 수도없이 튕겨서 미차겠네요.. 앱 관리 좀 해주세요..사용법도 여러가지 불편합니다...
269,270,20210325,2021,03,25,5,도현주,쉽고 편리해요~ 아주 잘 사용하고 있어요~
270,271,20210406,2021,04,06,5,김성훈,써봤던 뱅킹 앱중에서는 가장 직관적이고 사용이 편한듯 합니다.
271,272,20191122,2019,11,22,5,Google 사용자,"계좌조회,이체등 사용하기 편리하고 좋아요~^^"
272,273,20210423,2021,04,23,1,최헐크,아니 pc에서 공인인증서를가져왔는데 왜 화면에는뜨질않죠??공인인증서 발급을 11만원짜리로해야지만 조회가되는건가요?무슨이런경우가다있나
273,274,20200320,2020,03,20,3,Google 사용자,"PUSH 서비스 계좌설정이 안 되네요. 계좌설정하려고 하면 통장자동대출 한도 알림을 켜야 된다고 그러고, 통장자동대출 한도 알림을 켜려고 하면 계좌설정을 먼저 해야 한다고 하네요."
274,275,20210416,2021,04,16,1,박일섭,로그인을 할수가 없음 인증서를 가져오면 성공했다고 뜨는데 정작 인증서가 표기안되서 로그인불가 2차례 다시 복사해봐도 인증서 안뜸 타행 어플에서는 뜨는 인증서가 정작 국민은행 어플에선 국민은행 인증서가 뜨질않음 한 4시간정도 시간버림. 최악의 어플
275,276,20190426,2019,04,26,1,Google 사용자,업데이트 확인중이 너무 종종 나오네요 지금 20분넘게 접속이 안되네요
276,277,20200522,2020,05,22,5,최성욱,One Stop 관련해서 이용해봤는데 너무 편하고 좋네요~~^^
277,278,20220205,2022,02,05,1,김진웅,끝이 없는 오류... 콜센터는 전화 절대 안받음...속이 뒤집어짐
278,279,20220121,2022,01,21,1,marine black,아오 빡쳐. 모바일 otp발급오류 수정좀 하세요. 꼴란 주민번호 사업자번호 입력하는걸로도 사용자정보가 유효하지않다고 나오면 검증을 어떻게 하겠다는건지. 고객상담사들은 자기가 못알아들은걸 디폴트로 고객을 컴맹 취급하면서 짜증이나 내고. 짜증나서 못해먹겠네
279,280,20191122,2019,11,22,5,Google 사용자,지문등록 사용 할 수가 있어서 편리함
280,281,20191112,2019,11,12,5,Google 사용자,간편한 이체 너무 좋네요 타행과 비교해도 좋아요
281,282,20210127,2021,01,27,1,박찬남,살다살다 이렇게 구린어플과 응대는 처음봅니다 스마트폰 뱅킹이라는데 기본적이 계좌이체도 안되고 상담사는 공인인증서 로그인 잘못한거아니냐 어플 끄고 다시켜라 핸폰 끄고 다시켜라만말하는데 해결책이없음 결국 은행가서 해야될듯
282,283,20201011,2020,10,11,1,이병한,"진짜 답답하네요 지문,인증서 거래 다 전자서명 하라고 자꾸 헛소리해서 쿠키,데이터, 인터넷사용기록삭제, 어플재설치까지 다해도 안되서 고객센터 전화했더니 스타뱅킹으로 임시방편 사용하라고 대충 처리해주고 갑자기 오늘부터는 스타뱅킹에서도 기업인증서는 로그인 자체도 안되네요 돈 보낼곳은 많은데 답답하고 짜증나게하네요 그래도 1금융인데 어플이 무슨 이리 문제가 많나요?"
283,284,20210628,2021,06,28,1,고기남,제대로 작동 조차 하지않는 쓸모없는 앱. 하다가 암걸리겠네
284,285,20190118,2019,01,18,3,Google 사용자,갑자기 otp입력오류가 계속되는데..'정확히입력했는데오류면 마우스입력해보라'니 무슨말인가요?
285,286,20191122,2019,11,22,5,Google 사용자,편리하고 빠르게이용할수있어좋습니다
286,287,20210209,2021,02,09,1,윤영,앱자꾸꺼져요 너무불편합니다 안정화좀해주세요
287,288,20210219,2021,02,19,5,쫑삐리리,패턴으로 접속하니 너무편하고 좋아요 짱짱짱
288,289,20210217,2021,02,17,4,이후재,경조사등 카드나 메세지 보내기 기능이 있으면 좋겠습니다.
289,290,20191122,2019,11,22,5,Google 사용자,지문등록이 돼 아주 편리합니다.
290,291,20210325,2021,03,25,5,SUNGJOO KIM,다른 은행앱보다 빠르고 편리합니다.
291,292,20220204,2022,02,04,1,용주영,업데이트가 활성화 안되서 다시깔고 ㅜㅜㅜ
292,293,20191112,2019,11,12,5,Google 사용자,퀵 급여이체가 사용하는데 편리해서 계속 사용하게됩니다
293,294,20210325,2021,03,25,5,문채은,"사용하기 편리하고, 디자인이 깔끔해서 좋아요!"
294,295,20210401,2021,04,01,5,Alex Park,"간편하고, 정확하게 송수금할수있고 모바일로 은행업무 처리할수있어서 감사합니다. KB스타기업뱅킹의 더큰 성장과 발전을 기원합니다!!"
295,296,20191122,2019,11,22,5,Google 사용자,지문 추가가 되어 너무 편리해요
296,297,20210325,2021,03,25,5,류도리,잘쓰고있음 개인사업자는 지문로그인됐으면 좋겠음
297,298,20210402,2021,04,02,1,엄현정,계속 로그인이 안되요 삭제후 설치해도 안되고 쿠키삭제해도 안되고 어떻게해야 하나요 ㅠ
298,299,20210217,2021,02,17,3,youngnam kim,요즘에 기업뱅킹이 자꾸 스스로 꺼져서 잘 사용할 수가 없어요. 이거 방법이 없나요. 지금도 자꾸 꺼지니 내가 왜 이것 땜에 스트레스를 받아야 하는지요.
299,300,20190910,2019,09,10,1,Google 사용자,구림 안켜지고 ㅠㅠ 업데이트좀 작작햇으면
300,301,20191202,2019,12,02,4,Google 사용자,업데이트하고 카톡으로 이체내역 전송이 안돼는데 왜그런걸까요?
301,302,20190624,2019,06,24,1,Google 사용자,언제나 업데이트 확인중. 필요시 사용 불가
302,303,20201231,2020,12,31,1,KATO,결제예정금액 확인도 되질않네요 시스템오류..지겹다...
303,304,20191122,2019,11,22,5,Google 사용자,모바일앱 쓰고나서 인터넷뱅킹 쓸일이없네요 정말 편합니다
304,305,20211108,2021,11,08,5,송영진,어머니가 사용하시기 글씨가 작다고 보기어려워하셨는데 이번에 큰 글씨가 되는것같네요 앞으로도 많은 발전 부탁드립니다
305,306,20191122,2019,11,22,5,Google 사용자,사용이 간단한 편이예요 잘 쓰고 있어요
306,307,20190306,2019,03,06,1,Google 사용자,농협쓰다가 너무 불편해서 국민으로 넘어왔는데 더 불편해졌습니다... 하.... 왜 로그인할때마다 알림허용 동의창이 뜨나요.....
307,308,20190424,2019,04,24,1,Google 사용자,갤s8업데이트하고 앱하려니안됨 무한로딩..
308,309,20191122,2019,11,22,5,Google 사용자,지문로그인이 생겨서 편해졌어요
309,310,20200519,2020,05,19,5,Nani Lee,바뀐후에 상당히 편리해진것같습니다
310,311,20220113,2022,01,13,1,이은정,짜증나게 맨날 로그인이 안되죠?개인과 기업은 왜 따로만들어서 로그인도 다르게 해놔서 진짜 번거롭게했네요 !!!!
311,312,20210325,2021,03,25,5,MJ Yoo,항상 편리하게 잘 이용하고 있어요
312,313,20190306,2019,03,06,3,Google 사용자,삼성 갤럭시 SM-T595N에서 공인인증센터 메뉴가 보이지 않아 공인인증서를 사용할수 없습니다 개선 부탁드립니다
313,314,20190918,2019,09,18,1,Google 사용자,무한로딩 앱실행 전혀 안됩니다. 제거 대시 설치 이거 왜이런가요? 답답합니다. 사용안됩니다ㅋ
314,315,20191209,2019,12,09,5,Google 사용자,사용이 간편하고 알기쉽게 되어있습니다
315,316,20190705,2019,07,05,1,Google 사용자,간편로그인 기능이 없어 불편함
316,317,20210402,2021,04,02,1,조은희,저 왜갑자기접속이안되죠ㅠㅠ 삭제했다가 다시 설치해도 안돼요ㅠ
317,318,20191025,2019,10,25,5,Google 사용자,퀵급여이체 편리하고 지문이 돼서 좋아요
318,319,20191127,2019,11,27,5,Google 사용자,계속되는 업그레이드로 넘 편해졌어요
319,320,20210329,2021,03,29,5,시리우스,간편이체등 활용이 매우 쉽습니다
320,321,20220103,2022,01,03,3,soonwon hong,어플내에서 사용자가 입 출금에 메모를 할 수 있는 기능이 있었으면 합니다
321,322,20191122,2019,11,22,5,Google 사용자,여러 사업자의 경우 두번 로그인 안해서 좋아요^^
322,323,20220801,2022,08,01,5,김영수,다 좋은데 개인 계좌는 입출금시 푸시 알림이 오는데 기업 계좌는 설정을 해도 알림이 오지가 않네요 고객센터에 통화를 해도 지워서 다시 설치 해보라고 해서 그렇게 해도 안데요
323,324,20211110,2021,11,10,4,서진박,잘쓰고있습니다 근데 모바일에선 출석이벤트 못찾겠어요
324,325,20191122,2019,11,22,5,Google 사용자,구분되어져서 더 편리해졌습니다
325,326,20191122,2019,11,22,5,Google 사용자,별다섯개받을만큼 편리한기능 추가 칭찬해요
326,327,20210402,2021,04,02,1,이종윤,아니 도대체 로그인이 왜안되며 자꾸 로딩중 ㅡㅡ뭐냐고요
327,328,20211028,2021,10,28,1,kongkong s,"아래 이완수 고객의 말씀에 무한 동의합니다. 저도 숱하게 겪은 상황으로 몇달간 앱을 사용하지 못한 적도 있습니다. 사업하는데 앱을 지워버리지도 못하고 그림의떡같이 방치만 수개월..;; 그리고, 이체 시 보안매체 오류라고도 계속 떠서 콜센터 힘들게 대기 기다려서 상담원 연결되서 OTP 재조정하고 해도 똑같은 상황 무한반복.. 결국 앱이 문제였음. KB는 진짜 앱관리 안함. ㅆㄹㄱ앱임. 아래 댓글 쓰신 분! 사업하면서 그런 인증서의 기본도 모르고 이체하는 거 아닙니다. 맨날 무슨 상 탔다고 제1금융권의 1등 은행이라고 앱관리 따위는 우습게 아는건지, 사람들 혈압 오르게 하지말고 걍 없애던지 관리하던지 하라고 쫌 강력히 얘기해주세요! 몇달도 힘들 판에 몇년동안 수시로 같은 에러 반복은 문제 있지 않나요? 많이들 겪으실텐데 여기 평가로 쓰는 게 익숙치않아서 못 쓰고 어디다 하소연 못해 답답한 사람들 한 둘 아닐 겁니다. 저도 하도 답답해서 KB때문에 앱 후기란 것도 첨 써보네요!"
328,329,20191010,2019,10,10,1,Google 사용자,기업뱅킹 오랫동안 사용하는 사용자입니다. 어플화면 아랫쪽에 있는 상품라운지 코너좀 제발 없애주세요 그걸 왜 만들어 놨는지 이해가 안되네요 이체할때마다 눌러져서 이체목록 다 사라집니다. 얼마나 불편한줄 아세요. 이체목록 10개 다시 눌러보세요 얼마나 짜증나는지 .. 앱 개발자분들은 뱅킹 안쓰세요? 안써보고 만드시나요? 제발 어플 좀 생각하고 만드세요 .. 아니면 다른 버튼 클릭해도 이체목록이 사라지지 않게 하던지 좀 수정 좀 해주세요 고객들 떠나겠습니다.
329,330,20190920,2019,09,20,1,Google 사용자,별 1개도 아깝네. 업뎃 어쩌고하면서 로그인도 안됨
330,331,20220511,2022,05,11,5,김성군,기업뱅킹 급여이체 편리하네요.
331,332,20220313,2022,03,13,1,난나야,"인증서 로그인 졸 짜증 안됨 ,설명도 부족 .."
332,333,20191112,2019,11,12,5,Google 사용자,화면 구성이 좋아서 사용하기 편함
333,334,20210321,2021,03,21,1,정유나,앱 네트워크가 불안정 하다고 자꾸 꺼지는데 도대체 언제 개선 되나요?
334,335,20190912,2019,09,12,1,Google 사용자,이건 머 밤마다 업데이트카면 왜안되는건가요ㅡㅡ
335,336,20210405,2021,04,05,5,yeong an,전 주로 스타기업뱅킹을 이용합니다 가게를 운영하면서 주거래은행을 kb로 정했거든요 사용하기 편해요
336,337,20191226,2019,12,26,2,Google 사용자,전자세금용 인증서 발급이 없어서 불편하네요ㅡㅡ
337,338,20210402,2021,04,02,1,이선자,아무리기다려도 네트워크 뭐라고 하면서안켜져요 갑자기 왜이래요?
338,339,20211227,2021,12,27,5,Rain Kim,필요한 정보로 나열된 홈화면 편리합니다.
